,SID,NAME,LAT,LON,DIST2LAND,USA_STATUS,USA_WIND,USA_SSHS,STORM_SPEED,STORM_DIR,TIME,YEAR,MONTH,DAY,HOUR,R34avg,uv_max,rmax,rmax_avg,rmax_avg_adj,rmax_1,rmax_2,rmax_3,rmax_4,u200_mean,u200_std,u850_mean,u850_std,v200_mean,v200_std,v850_mean,v850_std,warm_core_diff_200_850,warm_core_pct_200_850,shear_u,shear_v,shear
0,2004214N30282,ALEX,30.3,281.7,284,TD,25,-1,9,325,7/31/04 18:00,2004,7,31,18,,21.701,240,230,230,240,240,200,240,-7.0453,5.9601,-0.6774,5.667,-1.856,4.3524,3.8826,5.9637,0.6187,0.234,-6.3679,-5.7386,3.3444
1,2004214N30282,ALEX,31,281.2,211,TD,25,-1,7,335,8/1/04 00:00,2004,8,1,0,,24.4161,250,265,265,240,250,370,200,-4.0705,5.7735,-0.9814,5.2154,-3.464,3.63,2.65,6.9241,0.6434,0.243,-3.0891,-6.114,2.519
2,2004214N30282,ALEX,31.5,281,154,TD,25,-1,3,340,8/1/04 06:00,2004,8,1,6,,22.0588,230,212.5,212.5,230,270,200,150,-2.8576,5.8964,-0.1073,4.9039,-5.7262,4.4843,3.8161,5.7776,0.7399,0.2794,-2.7503,-9.5423,2.582
3,2004214N30282,ALEX,31.6,280.9,140,TD,30,-1,1,290,8/1/04 12:00,2004,8,1,12,,20.9069,260,215,215,260,220,250,130,-2.1315,6.6812,0.7687,5.2028,-5.6494,5.6365,2.2222,7.4368,0.9497,0.3589,-2.9002,-7.8716,3.6867
4,2004214N30282,ALEX,31.6,280.8,134,TS,35,0,1,235,8/1/04 18:00,2004,8,1,18,46.3,22.489,190,155,155,220,190,120,90,-0.4704,6.4965,1.615,5.6176,-1.5682,6.8269,1.8701,6.3877,0.6439,0.2428,-2.0854,-3.4383,-0.8337
5,2004214N30282,ALEX,31.5,280.7,139,TS,35,0,2,225,8/2/04 00:00,2004,8,2,0,46.3,24.31,110,117.5,117.5,130,110,110,120,4.4134,6.6051,0.5007,5.9408,-2.2122,7.3283,1.5233,7.2192,0.5707,0.2148,3.9127,-3.7355,3.3333
6,2004214N30282,ALEX,31.4,280.6,145,TS,40,0,2,135,8/2/04 06:00,2004,8,2,6,111.12,25.8159,90,100,100,100,90,90,120,5.9738,6.7574,1.4046,6.3254,-2.053,6.8402,2.9134,7.2541,0.9119,0.3431,4.5692,-4.9664,3.0824
7,2004214N30282,ALEX,31.3,281,172,TS,50,0,4,60,8/2/04 12:00,2004,8,2,12,113.435,26.5618,130,137.5,137.5,100,130,200,120,7.5863,7.4684,2.2287,7.2434,-1.538,6.9053,2.2965,6.8139,0.8786,0.3312,5.3576,-3.8345,4.5405
8,2004214N30282,ALEX,31.8,281.3,149,TS,50,0,7,30,8/2/04 18:00,2004,8,2,18,113.435,26.8932,110,105,105,110,110,110,90,9.9157,6.454,2.0931,7.4434,0.5917,5.9466,2.769,6.9685,0.8185,0.3079,7.8226,-2.1773,6.4623
9,2004214N30282,ALEX,32.4,281.8,129,TS,60,0,8,45,8/3/04 00:00,2004,8,3,0,113.435,31.2445,150,122.5,122.5,150,150,100,90,11.9241,5.1229,0.6444,6.5165,2.5948,5.8109,2.9564,7.7683,1.0504,0.3951,11.2797,-0.3616,9.1773
10,2004214N30282,ALEX,33,282.6,114,HU,70,1,12,40,8/3/04 06:00,2004,8,3,6,118.065,35.3448,80,92.5,92.5,80,80,110,100,11.4697,5.0346,1.3514,6.2549,2.3789,7.1747,5.5377,8.2752,0.8424,0.3168,10.1183,-3.1588,6.0136
11,2004214N30282,ALEX,34.2,283.6,56,HU,85,2,15,35,8/3/04 12:00,2004,8,3,12,118.065,33.8193,90,105,105,100,90,130,100,11.0672,6.1737,2.5416,6.9573,3.3563,8.0386,3.6935,9.354,1.6606,0.6252,8.5256,-0.3372,7.0814
12,2004214N30282,ALEX,35.3,284.8,56,HU,85,2,14,50,8/3/04 18:00,2004,8,3,18,141.215,33.5504,110,95,95,90,110,110,70,10.8708,5.5407,2.4388,6.8456,7.3774,7.3447,3.137,10.4591,0.7627,0.2867,8.432,4.2404,9.1643
13,2004214N30282,ALEX,36,286.3,163,HU,80,1,15,60,8/4/04 00:00,2004,8,4,0,141.215,38.8711,110,122.5,122.5,90,110,170,120,13.3005,6.2431,4.6662,7.1051,7.0206,6.6513,1.2147,10.4038,1.1543,0.4344,8.6343,5.8059,10.218
14,2004214N30282,ALEX,36.8,287.9,312,HU,80,1,16,65,8/4/04 06:00,2004,8,4,6,152.79,34.5904,140,120,120,70,140,170,100,14.0066,5.4085,5.3958,7.1191,2.6493,5.3279,1.9825,11.1989,1.259,0.4738,8.6108,0.6668,8.5065
15,2004214N30282,ALEX,37.3,289.8,432,HU,85,2,16,75,8/4/04 12:00,2004,8,4,12,152.79,37.3897,80,82.5,82.5,80,80,80,90,10.3571,6.9648,6.2746,6.7306,1.1171,3.9059,2.2018,11.6067,1.4198,0.5334,4.0825,-1.0847,3.7675
16,2004214N30282,ALEX,37.8,291.7,457,HU,95,2,17,70,8/4/04 18:00,2004,8,4,18,203.72,37.178,60,125,125,240,60,90,110,9.8237,5.8599,7.4535,7.0464,6.4,3.6214,3.9459,11.059,1.1521,0.4331,2.3702,2.4541,3.291
17,2004214N30282,ALEX,38.5,294,491,HU,105,3,22,65,8/5/04 00:00,2004,8,5,0,199.09,41.1445,100,100,100,70,100,120,110,11.6478,4.9796,9.5085,7.0602,8.6454,5.5728,3.3492,10.9877,1.0992,0.4129,2.1393,5.2962,4.4246
18,2004214N30282,ALEX,39.5,296.9,480,HU,105,3,27,65,8/5/04 06:00,2004,8,5,6,268.54,41.0735,120,107.5,107.5,110,120,100,100,15.6697,6.544,10.2508,7.0572,10.0727,5.6534,4.2908,11.7282,1.1879,0.4468,5.4189,5.7819,7.5153
19,2004214N30282,ALEX,40.8,300.4,502,HU,100,3,34,60,8/5/04 12:00,2004,8,5,12,349.565,47.1763,90,77.5,77.5,50,90,80,90,19.4646,7.4885,11.6109,8.1841,11.4705,4.9764,6.5642,12.8858,1.5634,0.5871,7.8537,4.9063,9.255
20,2004214N30282,ALEX,42.7,305,447,HU,90,2,43,65,8/5/04 18:00,2004,8,5,18,347.25,46.4456,80,50,50,20,80,80,20,23.0555,7.3421,14.0214,9.5709,12.2587,7.9309,7.3822,12.2454,0.6272,0.2347,9.0341,4.8765,10.2659
21,2004214N30282,ALEX,44.5,310.7,381,HU,75,1,42,65,8/6/04 00:00,2004,8,6,0,347.25,42.8313,100,57.5,57.5,10,80,100,40,27.0438,8.795,14.2614,9.3596,8.5195,7.2041,5.1436,10.0176,0.2383,0.0895,12.7824,3.3759,13.1934
22,2004214N30282,ALEX,46.1,315.8,655,HU,65,1,43,75,8/6/04 06:00,2004,8,6,6,347.25,38.764,160,92.5,92.5,30,170,160,10,33.8468,10.5869,14.3644,9.7322,1.4828,4.5463,3.8876,9.2313,0.5233,0.1972,19.4824,-2.4048,18.9981
23,2004214N30282,ALEX,47,322.5,1134,TS,50,0,41,80,8/6/04 12:00,2004,8,6,12,347.25,34.9985,290,137.5,137.5,10,170,290,80,35.9329,10.8434,15.1116,9.1867,-8.0987,4.9535,0.7636,7.0392,0.5538,0.2097,20.8213,-8.8623,21.7034
24,2004214N30282,ALEX,47.4,327.3,1485,EX,30,-4,30,85,8/6/04 18:00,2004,8,6,18,,32.1857,400,392.5,392.5,490,230,400,450,38.3985,12.1602,13.8679,7.8509,-11.3493,2.896,-1.7378,7.0456,2.4807,0.9485,24.5306,-9.6115,26.0643
25,2004217N13306,BONNIE,12.9,306.4,786,TD,25,-1,17,280,8/3/04 12:00,2004,8,3,12,,22.0872,320,370,370,320,440,470,250,-5.3781,2.9411,-7.2662,4.0737,3.6055,4.059,2.2822,4.0008,-0.049,-0.0185,1.8881,1.3233,-1.1413
26,2004217N13306,BONNIE,13.2,304.6,670,TD,25,-1,19,280,8/3/04 18:00,2004,8,3,18,,22.1603,330,290,290,330,200,300,330,-4.0346,3.0465,-7.2383,4.3192,4.2532,4.8814,2.7362,4.176,0.0517,0.0195,3.2037,1.517,-1.8758
27,2004217N13306,BONNIE,13.5,302.6,501,TD,30,-1,20,275,8/4/04 00:00,2004,8,4,0,,21.4513,400,300,300,400,200,410,190,-2.88,2.7003,-7.4087,3.8197,3.909,4.8594,2.0617,4.4975,-0.0185,-0.007,4.5287,1.8473,-2.8348
28,2004217N13306,BONNIE,13.6,300.5,363,TD,30,-1,21,270,8/4/04 06:00,2004,8,4,6,,20.675,280,282.5,282.5,280,210,350,290,-0.9777,2.8601,-8.3336,3.2161,3.8246,4.0542,2.9652,3.8945,0.1728,0.0653,7.3559,0.8594,-4.8978
29,2004217N13306,BONNIE,13.6,298.4,324,TD,30,-1,21,270,8/4/04 12:00,2004,8,4,12,,20.9688,340,397.5,397.5,400,380,470,340,-0.2066,3.823,-7.394,2.8575,1.9113,4.4913,3.7281,4.5872,0.3012,0.1139,7.1874,-1.8168,-6.3583
30,2004217N13306,BONNIE,13.7,296.3,342,WV,30,-3,20,275,8/4/04 18:00,2004,8,4,18,,21.3167,410,390,390,410,240,490,420,-2.141,3.8959,-7.0273,3.0959,2.8518,5.6953,4.3521,4.851,0.1194,0.0451,4.8863,-1.5003,-4.6998
31,2004217N13306,BONNIE,14,294.3,382,WV,25,-3,20,285,8/5/04 00:00,2004,8,5,0,,20.7882,260,362.5,362.5,260,320,500,370,1.573,4.2449,-6.9801,2.7886,4.06,3.5682,4.0105,4.6431,0.2498,0.0943,8.5531,0.0495,-3.6961
32,2004217N13306,BONNIE,14.9,292.3,339,WV,25,-3,22,300,8/5/04 06:00,2004,8,5,6,,21.9294,320,355,355,310,320,490,300,4.9948,4.3071,-7.9962,2.2039,4.2424,6.0067,4.0705,5.2451,0.2564,0.0969,12.991,0.1719,-2.4193
33,2004217N13306,BONNIE,16,290.3,251,WV,25,-3,20,295,8/5/04 12:00,2004,8,5,12,,22.637,430,317.5,317.5,280,430,380,180,8.5158,5.8435,-7.6416,2.1146,1.9905,4.8927,3.6486,6.5519,0.1732,0.0655,16.1574,-1.6581,0.2774
34,2004217N13306,BONNIE,16.5,288.5,123,WV,25,-3,16,285,8/5/04 18:00,2004,8,5,18,,23.2914,460,242.5,242.5,90,460,330,90,8.5877,9.3336,-7.737,2.4027,3.1769,5.8666,3.5195,6.353,-0.0076,-0.0029,16.3247,-0.3426,0.6566
35,2004217N13306,BONNIE,17,287,124,WV,25,-3,15,280,8/6/04 00:00,2004,8,6,0,,21.3469,100,212.5,212.5,100,500,220,30,7.7768,10.8397,-6.0284,2.809,3.9791,5.9781,2.5084,5.7455,-0.1737,-0.0656,13.8052,1.4707,2.2062
36,2004217N13306,BONNIE,17.1,285.4,125,WV,25,-3,16,275,8/6/04 06:00,2004,8,6,6,,19.0653,490,312.5,312.5,200,490,470,90,4.1012,11.3908,-4.8725,3.3395,2.13,7.9007,1.3488,4.9825,-0.279,-0.1054,8.9737,0.7812,-0.4344
37,2004217N13306,BONNIE,17.2,283.8,78,WV,25,-3,12,265,8/6/04 12:00,2004,8,6,12,,19.0571,360,292.5,292.5,320,360,430,60,0.1489,11.6377,-5.5192,3.305,2.3877,8.675,1.5598,4.0964,-0.4007,-0.1513,5.6681,0.8279,-3.343
38,2004217N13306,BONNIE,17,282.8,78,WV,25,-3,9,265,8/6/04 18:00,2004,8,6,18,,21.5744,460,342.5,342.5,460,440,280,190,-1.7406,9.9788,-5.2137,3.6,2.5827,9.9862,2.8002,3.8158,-0.3476,-0.1312,3.4731,-0.2175,-2.8036
39,2004217N13306,BONNIE,17.1,281.8,104,WV,25,-3,10,285,8/7/04 00:00,2004,8,7,0,,18.4504,480,285,285,340,480,250,70,-5.2825,7.4033,-5.5763,2.6075,4.5961,7.68,0.3281,4.0318,-0.2889,-0.109,0.2938,4.268,1.4161
40,2004217N13306,BONNIE,17.4,280.8,123,WV,20,-3,10,290,8/7/04 06:00,2004,8,7,6,,20.5214,470,227.5,227.5,390,470,40,10,-6.4016,4.8657,-6.7698,2.5948,5.7017,6.3416,1.5492,3.7687,-0.0556,-0.021,0.3682,4.1525,1.6278
41,2004217N13306,BONNIE,17.8,279.8,195,WV,20,-3,10,300,8/7/04 12:00,2004,8,7,12,,22.1815,480,265,265,500,480,60,20,-8.0849,3.6881,-7.2181,2.5963,4.3969,7.2749,3.1904,3.6759,-0.1757,-0.0663,-0.8668,1.2065,1.3114
42,2004217N13306,BONNIE,18.4,278.9,285,WV,20,-3,10,305,8/7/04 18:00,2004,8,7,18,,21.82,480,252.5,252.5,370,480,90,70,-10.1604,2.532,-5.7298,2.9365,6.3124,5.5363,4.303,3.0537,-0.0464,-0.0175,-4.4306,2.0094,4.796
43,2004217N13306,BONNIE,19,278.1,284,WV,20,-3,10,310,8/8/04 00:00,2004,8,8,0,,21.0707,490,430,430,480,490,480,270,-9.2755,2.9876,-4.8217,2.801,6.0446,4.1848,2.1905,3.329,-0.1806,-0.068,-4.4538,3.8541,5.7753
44,2004217N13306,BONNIE,19.7,277.3,190,WV,25,-3,10,310,8/8/04 06:00,2004,8,8,6,,19.4626,70,42.5,42.5,70,70,20,10,-8.5845,4.9032,-6.7934,2.5635,5.0395,3.5405,2.2197,2.9745,-0.0193,-0.0073,-1.7911,2.8198,2.8076
45,2004217N13306,BONNIE,20.3,276.5,142,TD,25,-1,9,310,8/8/04 12:00,2004,8,8,12,,20.3829,480,150,150,80,480,10,30,-8.2506,6.7338,-7.3841,2.6837,2.4926,4.3967,4.9914,2.9931,-0.0999,-0.0376,-0.8665,-2.4988,-0.294
46,2004217N13306,BONNIE,20.9,275.7,102,TD,25,-1,11,305,8/8/04 18:00,2004,8,8,18,,19.5023,370,235,235,270,370,210,90,-8.1356,5.8603,-5.1785,3.3054,0.0709,4.8286,5.1884,3.062,-0.0705,-0.0265,-2.9571,-5.1175,0.8054
47,2004217N13306,BONNIE,21.5,274.5,68,TD,25,-1,12,295,8/9/04 00:00,2004,8,9,0,,15.4457,410,240,240,100,410,290,160,-8.2494,4.9771,-4.688,2.326,-1.3635,5.0753,1.7245,3.9018,-0.1685,-0.0634,-3.5614,-3.088,3.3662
48,2004217N13306,BONNIE,22,273.4,69,TD,30,-1,11,295,8/9/04 06:00,2004,8,9,6,,18.5485,160,210,210,160,90,430,160,-7.6432,4.9667,-6.8738,2.0221,-1.4037,4.3868,3.1157,3.354,-0.0038,-0.0014,-0.7694,-4.5194,0.2241
49,2004217N13306,BONNIE,22.5,272.4,112,TS,35,0,9,300,8/9/04 12:00,2004,8,9,12,46.3,16.5902,100,285,285,100,440,470,130,-4.9797,4.1903,-5.05,2.8286,-3.4086,4.0304,4.9446,3.2137,0.1133,0.0427,0.0703,-8.3532,-1.0331
50,2004217N13306,BONNIE,22.9,271.7,156,TS,40,0,7,295,8/9/04 18:00,2004,8,9,18,46.3,13.0181,480,285,285,250,480,210,200,-6.141,4.5862,-2.4465,2.4629,-4.4882,3.3708,3.1756,3.598,-0.1538,-0.0579,-3.6945,-7.6638,3.5976
51,2004217N13306,BONNIE,23.1,271,183,TS,45,0,7,285,8/10/04 00:00,2004,8,10,0,46.3,16.6952,400,392.5,392.5,480,480,400,210,-6.0416,4.3317,-3.0883,2.2315,-4.1556,3.9008,0.0653,3.6537,0.0706,0.0266,-2.9533,-4.2209,4.2438
52,2004217N13306,BONNIE,23.4,270.2,240,TS,45,0,9,300,8/10/04 06:00,2004,8,10,6,46.3,16.4467,170,242.5,242.5,180,170,450,170,-4.1515,4.9379,-4.8028,2.5372,-4.5097,2.7123,2.799,3.3896,0.0474,0.0179,0.6513,-7.3087,0.5707
53,2004217N13306,BONNIE,24,269.4,321,TS,50,0,6,325,8/10/04 12:00,2004,8,10,12,46.3,18.1891,110,97.5,97.5,110,140,130,10,-1.7792,5.7872,-1.6413,2.3601,-7.7401,2.6491,3.7805,3.2073,0.0234,0.0088,-0.1379,-11.5206,3.8205
54,2004217N13306,BONNIE,24.4,269.4,364,TS,45,0,3,10,8/10/04 18:00,2004,8,10,18,60.19,12.4148,480,195,195,480,50,140,110,-3.4221,6.4237,0.364,1.9394,-5.4244,2.0479,1.3494,3.4172,0.0452,0.017,-3.7861,-6.7738,5.016
55,2004217N13306,BONNIE,24.7,269.4,397,TS,40,0,4,0,8/11/04 00:00,2004,8,11,0,46.3,14.5963,160,215,215,160,80,490,130,-0.0787,6.1474,-0.6587,2.2869,-3.4106,2.9307,0.023,3.8747,0.2808,0.1057,0.58,-3.4336,2.7524
56,2004217N13306,BONNIE,25.2,269.4,435,TS,40,0,5,5,8/11/04 06:00,2004,8,11,6,60.19,17.7068,110,80,80,110,110,20,80,3.4703,7.264,-1.6476,1.9715,-3.4538,3.2266,3.1882,4.1489,0.063,0.0237,5.1179,-6.642,1.3073
57,2004217N13306,BONNIE,25.7,269.6,380,TS,45,0,8,35,8/11/04 12:00,2004,8,11,12,71.765,17.4487,80,32.5,32.5,80,20,20,10,7.3265,7.5007,1.1698,2.4604,-2.9363,3.8213,2.3855,3.6159,0.0862,0.0325,6.1567,-5.3218,5.2361
58,2004217N13306,BONNIE,26.4,270.4,294,TS,55,0,10,50,8/11/04 18:00,2004,8,11,18,71.765,16.2786,220,282.5,282.5,480,200,220,230,8.4199,6.5634,3.0018,2.465,-0.8365,5.6552,2.4515,3.5428,0.5968,0.2255,5.4181,-3.288,4.5857
59,2004217N13306,BONNIE,27,271.2,225,TS,50,0,8,45,8/12/04 00:00,2004,8,12,0,71.765,17.3302,170,237.5,237.5,230,170,170,380,11.9102,8.2464,4.2266,2.6456,2.5157,5.7314,2.058,3.8345,0.3634,0.1371,7.6836,0.4577,7.472
60,2004217N13306,BONNIE,27.7,271.9,174,TS,45,0,15,50,8/12/04 06:00,2004,8,12,6,71.765,20.1793,130,230,230,200,130,180,410,14.0127,7.6503,2.8362,2.4728,3.7943,6.2945,3.6027,4.99,0.555,0.2098,11.1765,0.1916,9.9322
61,2004217N13306,BONNIE,29,273.9,103,TS,45,0,28,55,8/12/04 12:00,2004,8,12,12,71.765,23.8139,140,107.5,107.5,50,140,190,50,14.4439,8.17,5.7067,3.1196,9.7081,8.8485,4.9405,6.0676,0.4224,0.1597,8.7372,4.7676,9.8551
62,2004217N13306,BONNIE,30.2,276,0,TD,30,-1,21,55,8/12/04 18:00,2004,8,12,18,,26.1139,110,300,300,490,110,130,470,14.8239,6.4613,5.9944,2.8735,18.9191,7.9285,5.2432,6.4623,1.0661,0.4048,8.8295,13.6759,16.0711
63,2004217N13306,BONNIE,31.9,278.7,0,TD,25,-1,28,50,8/13/04 00:00,2004,8,13,0,,23.6723,180,337.5,337.5,330,180,350,490,19.5756,6.6186,6.4896,3.4644,22.8945,9.4722,5.9571,6.6792,1.4345,0.5454,13.086,16.9374,21.3133
64,2004217N13306,BONNIE,33.5,281,9,TD,25,-1,27,50,8/13/04 06:00,2004,8,13,6,,26.7354,210,292.5,292.5,210,210,260,490,22.3394,6.2173,5.7226,2.981,22.4647,10.9692,8.1132,6.5189,1.4095,0.5359,16.6168,14.3515,21.7531
65,2004217N13306,BONNIE,35.5,283.5,0,TD,25,-1,25,45,8/13/04 12:00,2004,8,13,12,,25.6264,340,240,240,280,260,340,80,22.4944,5.4798,7.1709,3.835,24.0527,13.2625,7.9697,5.4345,1.1341,0.431,15.3235,16.083,22.2113
66,2004217N13306,BONNIE,37.1,285.1,83,TD,25,-1,20,35,8/13/04 18:00,2004,8,13,18,,24.6372,190,137.5,137.5,180,190,170,10,22.8568,8.4835,8.0695,4.5485,24.3016,15.265,7.8513,5.6502,0.7254,0.2751,14.7873,16.4503,22.1029
67,2004217N13306,BONNIE,39,286.5,88,LO,20,-3,23,30,8/14/04 00:00,2004,8,14,0,,23.7999,320,232.5,232.5,200,320,340,70,23.4948,10.3938,8.3426,3.6233,26.5271,15.7086,5.5101,5.7791,1.5581,0.5931,15.1522,21.017,25.4377
68,2004223N11301,CHARLEY,11.4,300.8,211,TD,30,-1,18,280,8/9/04 12:00,2004,8,9,12,,26.3495,330,192.5,192.5,330,230,10,200,-11.48,3.6169,-8.8727,6.721,1.2295,5.9199,2.4736,3.9302,0.2474,0.0936,-2.6073,-1.2441,2.3346
69,2004223N11301,CHARLEY,11.7,298.9,111,TD,30,-1,20,280,8/9/04 18:00,2004,8,9,18,,26.4083,260,220,220,260,200,230,190,-10.1356,4.7314,-7.8445,7.6263,0.5633,6.3503,3.8094,3.9651,0.1682,0.0635,-2.2911,-3.2461,1.4307
70,2004223N11301,CHARLEY,12.2,296.8,168,TD,30,-1,21,285,8/10/04 00:00,2004,8,10,0,,23.2694,170,245,245,170,260,380,170,-9.2225,3.6708,-8.2907,6.4746,1.3475,3.5459,3.5174,3.013,0.1607,0.0607,-0.9318,-2.1699,0.3144
71,2004223N11301,CHARLEY,12.9,294.7,268,TS,35,0,23,290,8/10/04 06:00,2004,8,10,6,57.875,25.0279,170,267.5,267.5,170,240,490,170,-8.6996,3.5294,-7.9167,6.8934,1.6895,3.123,5.3464,2.9538,0.0786,0.0297,-0.7829,-3.6569,-0.6908
72,2004223N11301,CHARLEY,13.8,292.4,298,TS,40,0,25,295,8/10/04 12:00,2004,8,10,12,99.545,28.7539,150,197.5,197.5,150,80,410,150,-8.9715,4.0669,-7.98,8.0464,0.5768,5.3028,5.7075,5.3187,0.1898,0.0717,-0.9915,-5.1307,-0.821
73,2004223N11301,CHARLEY,14.9,290.2,313,TS,45,0,22,295,8/10/04 18:00,2004,8,10,18,99.545,30.0839,170,282.5,282.5,170,400,390,170,-10.1527,4.2248,-9.0144,6.2254,2.6976,6.7309,4.8762,5.6887,0.2985,0.1126,-1.1383,-2.1786,0.2562
74,2004223N11301,CHARLEY,15.6,288.2,227,TS,55,0,20,285,8/11/04 00:00,2004,8,11,0,99.545,28.2319,180,247.5,247.5,100,480,230,180,-6.8349,3.7055,-9.8343,4.2725,3.1671,5.6286,3.3281,6.7422,0.1321,0.0498,2.9994,-0.161,-2.8492
75,2004223N11301,CHARLEY,16,286.3,224,TS,55,0,18,280,8/11/04 06:00,2004,8,11,6,99.545,25.7411,60,125,125,60,80,220,140,-5.5873,3.3682,-10.0814,3.7847,3.5588,5.6959,2.2883,6.7299,0.1336,0.0504,4.4941,1.2705,-3.7134
76,2004223N11301,CHARLEY,16.3,284.6,198,TS,60,0,15,280,8/11/04 12:00,2004,8,11,12,111.12,28.4687,100,107.5,107.5,100,90,140,100,-3.4218,3.6282,-9.4174,4.0212,2.6582,5.9115,4.3161,6.1079,0.0864,0.0326,5.9956,-1.6579,-6.0264
77,2004223N11301,CHARLEY,16.7,283.2,119,HU,65,1,14,295,8/11/04 18:00,2004,8,11,18,111.12,28.2164,100,137.5,137.5,100,330,30,90,-4.8716,3.7079,-8.8775,4.5656,3.744,6.1596,4.8478,5.8733,0.07,0.0264,4.0059,-1.1038,-3.9708
78,2004223N11301,CHARLEY,17.4,281.9,70,HU,65,1,14,305,8/12/04 00:00,2004,8,12,0,125.01,26.5401,280,180,180,280,110,110,220,-2.7014,4.7539,-7.8836,4.7761,3.4469,6.7867,4.2731,7.0078,0.1238,0.0466,5.1822,-0.8262,-4.5878
79,2004223N11301,CHARLEY,18.2,280.7,95,HU,75,1,15,305,8/12/04 06:00,2004,8,12,6,125.01,36.8819,40,85,85,40,60,180,60,-2.669,4.8344,-7.6435,6.2566,3.2387,8.2029,3.4886,7.4594,0.7325,0.276,4.9745,-0.2499,-4.2052
80,2004223N11301,CHARLEY,19.2,279.3,266,HU,80,1,16,315,8/12/04 12:00,2004,8,12,12,131.955,39.6695,100,92.5,92.5,100,150,60,60,-4.8258,4.5162,-7.7819,7.0067,5.3472,8.6305,5.0512,8.1609,1.107,0.4171,2.9561,0.296,-2.0747
81,2004223N11301,CHARLEY,20.5,278.4,154,HU,90,2,14,330,8/12/04 18:00,2004,8,12,18,143.53,38.6507,90,72.5,72.5,80,90,70,50,-4.9313,4.747,-5.9997,5.8457,8.9247,6.1231,6.6765,8.826,0.7579,0.2854,1.0684,2.2482,1.2203
82,2004223N11301,CHARLEY,21.7,277.8,32,HU,90,2,14,335,8/13/04 00:00,2004,8,13,0,145.845,39.7623,50,62.5,62.5,70,50,100,30,-3.9048,4.886,-3.0672,6.1373,9.3281,6.2819,4.4957,8.3021,1.2753,0.4795,-0.8376,4.8324,4.6701
83,2004223N11301,CHARLEY,23,277.4,0,HU,105,3,13,350,8/13/04 06:00,2004,8,13,6,145.845,38.8116,30,55,55,50,60,80,30,-1.0596,4.9795,-2.9363,5.3722,9.5692,6.392,5.8597,8.0336,1.0463,0.3937,1.8767,3.7095,3.0735
84,2004223N11301,CHARLEY,24.4,277.1,150,HU,95,2,16,0,8/13/04 12:00,2004,8,13,12,152.79,39.9912,70,75,75,80,70,60,90,2.0376,3.675,0.1597,6.4322,8.6336,7.6444,8.3385,8.8664,1.2657,0.4764,1.8779,0.2951,0.5308
85,2004223N11301,CHARLEY,26.1,277.6,59,HU,125,4,18,20,8/13/04 18:00,2004,8,13,18,111.12,39.9555,80,50,50,10,80,70,40,3.8958,6.5261,1.4266,6.3332,9.8587,8.8396,8.7187,9.0303,1.3365,0.5021,2.4692,1.14,1.7659
86,2004223N11301,CHARLEY,28.1,278.4,0,HU,75,1,23,20,8/14/04 00:00,2004,8,14,0,90.285,29.7871,40,117.5,117.5,120,40,180,130,5.5263,6.4515,1.756,6.9731,12.2741,10.2244,8.8931,7.6677,1.0956,0.4134,3.7703,3.381,4.396
87,2004223N11301,CHARLEY,30.1,279.2,57,HU,75,1,23,20,8/14/04 06:00,2004,8,14,6,118.065,44.6763,60,52.5,52.5,50,60,60,40,8.6061,6.6569,0.5184,6.3112,18.743,11.1788,9.4973,7.1471,1.4268,0.5376,8.0877,9.2457,11.1129
88,2004223N11301,CHARLEY,32.3,280.3,43,HU,65,1,23,20,8/14/04 12:00,2004,8,14,12,118.065,40.8209,120,70,70,30,120,110,20,9.9508,7.0346,1.3692,6.459,24.187,13.8413,8.5341,7.3056,1.9129,0.7237,8.5816,15.6529,17.5107
89,2004223N11301,CHARLEY,34.5,281.9,0,TS,60,0,28,35,8/14/04 18:00,2004,8,14,18,97.23,37.1485,60,77.5,77.5,70,60,80,100,10.5368,6.7136,2.1229,7.1266,27.2145,14.5807,6.6999,7.8151,1.4794,0.5605,8.4139,20.5146,22.1549
90,2004223N11301,CHARLEY,36.9,284.1,14,EX,40,-4,30,35,8/15/04 00:00,2004,8,15,0,78.71,29.2743,90,75,75,10,90,170,30,15.5458,10.5599,2.404,4.5357,27.7837,15.2769,6.2865,6.5855,0.3042,0.1154,13.1418,21.4972,25.1067
91,2004223N11301,CHARLEY,39.3,286.2,48,EX,35,-4,28,40,8/15/04 06:00,2004,8,15,6,78.71,26.956,130,80,80,20,140,130,30,17.0721,14.1589,2.5884,4.1038,28.2184,14.1347,6.6272,6.6904,0.2246,0.0855,14.4837,21.5912,25.8661
92,2004223N11301,CHARLEY,41.2,288.9,33,EX,30,-4,28,50,8/15/04 12:00,2004,8,15,12,,21.0785,230,197.5,197.5,210,300,230,50,15.8052,13.5808,4.0179,4.9794,27.9023,10.8839,4.412,4.6997,1.1054,0.4232,11.7873,23.4903,26.1004
93,2004227N09314,EARL,9,314.4,821,TD,30,-1,18,275,8/13/04 18:00,2004,8,13,18,,22.236,280,272.5,272.5,280,280,200,330,-7.4096,4.8239,-6.4386,6.3191,2.2013,7.1431,1.8225,4.0277,0.1782,0.0674,-0.971,0.3788,1.0381
94,2004227N09314,EARL,9.2,312.6,697,TD,30,-1,18,280,8/14/04 00:00,2004,8,14,0,,19.9194,240,395,395,240,400,470,470,-7.7135,3.0494,-6.8961,5.2528,1.055,5.0915,0.9575,3.2205,0.1281,0.0485,-0.8174,0.0975,0.8231
95,2004227N09314,EARL,9.6,310.8,619,TD,30,-1,20,285,8/14/04 06:00,2004,8,14,6,,22.9688,220,185,185,220,150,50,320,-6.4485,3.538,-8.1718,5.31,1.3399,6.0988,1.3411,3.4007,0.1011,0.0383,1.7233,-0.0012,-1.6949
96,2004227N09314,EARL,10.1,308.6,558,TD,30,-1,22,280,8/14/04 12:00,2004,8,14,12,,22.6898,130,175,175,130,60,140,370,-6.0448,3.4775,-8.1092,5.0448,1.3721,5.5835,2.7049,3.1329,-0.0334,-0.0126,2.0644,-1.3328,-2.3499
97,2004227N09314,EARL,10.5,306.5,521,TS,35,0,23,280,8/14/04 18:00,2004,8,14,18,69.45,20.2547,100,190,190,100,230,250,180,-7.7876,2.8916,-7.2722,5.1399,3.7096,5.4459,2.1852,3.5149,0.0827,0.0313,-0.5154,1.5244,1.0326
98,2004227N09314,EARL,11,304.1,478,TS,35,0,24,280,8/15/04 00:00,2004,8,15,0,69.45,22.9822,210,155,155,210,230,20,160,-8.1988,2.2195,-9.0087,4.6001,5.1552,4.9874,2.338,4.0921,0.0953,0.036,0.8099,2.8172,0.3777
99,2004227N09314,EARL,11.5,301.7,308,TS,45,0,25,280,8/15/04 06:00,2004,8,15,6,76.395,25.1917,240,247.5,247.5,240,310,270,170,-6.8401,2.5554,-10.5118,4.546,4.8518,4.3467,3.0089,4.1091,0.1929,0.073,3.6717,1.8429,-2.5478
100,2004227N09314,EARL,11.8,299.2,125,TS,45,0,22,275,8/15/04 12:00,2004,8,15,12,76.395,26.7663,240,277.5,277.5,240,170,430,270,-6.8144,3.6078,-9.8945,5.6164,3.7276,5.3235,2.886,4.6681,0.2675,0.1012,3.0801,0.8416,-2.5395
101,2004227N09314,EARL,12.1,297.2,156,TS,35,0,19,280,8/15/04 18:00,2004,8,15,18,69.45,28.9063,270,320,320,270,240,480,290,-9.8634,3.3366,-9.5729,5.2948,3.5328,5.1737,3.2413,4.2159,0.0765,0.0289,-0.2905,0.2915,0.3702
102,2004227N12338,DANIELLE,12.3,338.2,537,TD,30,-1,12,275,8/13/04 12:00,2004,8,13,12,,22.0904,300,395,395,500,300,360,420,-7.9508,2.6506,-1.6003,8.2277,-0.615,3.8718,1.8692,4.8007,-0.0154,-0.0058,-6.3505,-2.4842,5.5139
103,2004227N12338,DANIELLE,12.4,337,648,TD,30,-1,12,275,8/13/04 18:00,2004,8,13,18,,23.3864,170,335,335,170,360,480,330,-6.2624,3.7754,-1.261,8.4073,1.5391,4.0085,1.8352,4.9038,-0.0447,-0.0169,-5.0014,-0.2961,4.2221
104,2004227N12338,DANIELLE,12.6,335.8,761,TS,35,0,12,280,8/14/04 00:00,2004,8,14,0,83.34,24.7909,320,232.5,232.5,120,320,370,120,-6.545,4.0339,-1.9034,7.4264,0.6948,3.5052,1.5334,5.5621,-0.0461,-0.0174,-4.6416,-0.8386,4.1375
105,2004227N12338,DANIELLE,12.9,334.5,887,TS,40,0,13,285,8/14/04 06:00,2004,8,14,6,92.6,24.0634,70,52.5,52.5,30,80,30,70,-6.8871,3.6189,-2.0359,8.1521,0.1852,4.1393,1.0071,6.2573,0.4403,0.1661,-4.8512,-0.8219,4.6182
106,2004227N12338,DANIELLE,13.2,333.2,1017,TS,45,0,13,285,8/14/04 12:00,2004,8,14,12,97.23,23.5984,40,75,75,40,170,30,60,-6.7116,3.8539,-2.6879,7.5111,0.068,4.7957,0.4816,5.8932,0.0985,0.0372,-4.0237,-0.4136,3.9812
107,2004227N12338,DANIELLE,13.5,331.9,1151,TS,55,0,12,285,8/14/04 18:00,2004,8,14,18,145.845,23.0149,490,142.5,142.5,20,490,30,30,-6.4147,4.6859,-3.0521,7.6863,0.8569,4.686,0.6256,6.339,0.1127,0.0425,-3.3626,0.2313,3.3561
108,2004227N12338,DANIELLE,13.8,330.7,1276,HU,65,1,13,280,8/15/04 00:00,2004,8,15,0,166.68,25.1937,50,32.5,32.5,50,10,20,50,-6.5463,4.5536,-4.7033,6.8697,0.6273,4.6964,0.603,5.5972,-0.0552,-0.0208,-1.843,0.0243,1.8345
109,2004227N12338,DANIELLE,14.1,329.2,1434,HU,75,1,14,290,8/15/04 06:00,2004,8,15,6,171.31,27.3745,70,75,75,70,150,40,40,-7.7054,4.6578,-4.5245,7.2077,0.7266,5.7541,1.4619,6.2401,0.1036,0.039,-3.1809,-0.7353,2.9848
110,2004227N12338,DANIELLE,14.7,327.9,1570,HU,80,1,14,295,8/15/04 12:00,2004,8,15,12,180.57,28.2009,160,112.5,112.5,160,190,40,60,-7.6846,4.0226,-4.6692,7.6641,1.6233,6.0152,2.9537,7.4101,0.2094,0.0789,-3.0154,-1.3304,2.3292
111,2004227N12338,DANIELLE,15.2,326.5,1720,HU,85,2,15,295,8/15/04 18:00,2004,8,15,18,180.57,27.4101,70,105,105,150,140,60,70,-6.5474,4.6444,-3.7637,7.4534,2.2865,6.3423,2.0957,7.5158,0.2632,0.099,-2.7837,0.1908,2.6273
112,2004227N12338,DANIELLE,16,325.2,1860,HU,90,2,15,305,8/16/04 00:00,2004,8,16,0,162.05,29.2519,110,100,100,110,170,60,60,-3.2502,4.2805,-5.2485,7.0767,3.4587,3.896,1.4374,7.3486,0.4702,0.1771,1.9983,2.0213,-0.6956
113,2004227N12338,DANIELLE,16.8,324,1993,HU,90,2,14,305,8/16/04 06:00,2004,8,16,6,152.79,32.1044,110,67.5,67.5,50,110,50,60,-1.4035,4.2926,-6.4015,6.7391,4.5019,5.202,2.3169,7.2486,0.6143,0.2313,4.998,2.185,-2.0923
114,2004227N12338,DANIELLE,17.7,322.8,2129,HU,90,2,15,315,8/16/04 12:00,2004,8,16,12,138.9,33.797,100,85,85,100,100,80,60,-1.3405,4.5095,-6.5592,6.3431,6.1681,6.1818,2.7067,6.6848,0.5585,0.2105,5.2187,3.4614,-0.7836
115,2004227N12338,DANIELLE,19,321.8,2175,HU,95,2,15,330,8/16/04 18:00,2004,8,16,18,131.955,38.8535,30,47.5,47.5,20,80,60,30,0.8532,4.8253,-6.1704,7.0523,9.9214,6.8576,2.5193,6.9052,0.428,0.161,7.0236,7.4021,3.2931
116,2004227N12338,DANIELLE,20.3,321.1,2238,HU,95,2,15,335,8/17/04 00:00,2004,8,17,0,138.9,39.4351,70,35,35,40,70,10,20,3.4504,4.8157,-7.1487,5.7445,11.9193,6.2921,1.6976,6.3177,0.0486,0.0183,10.5991,10.2217,5.0612
117,2004227N12338,DANIELLE,21.7,320.4,2318,HU,90,2,16,340,8/17/04 06:00,2004,8,17,6,138.9,42.9688,40,37.5,37.5,30,40,70,10,6.4246,4.8997,-6.9268,6.3977,13.8474,7.5341,2.9839,6.8818,-0.1519,-0.0572,13.3514,10.8635,7.723
118,2004227N12338,DANIELLE,23.3,320,2364,HU,90,2,15,350,8/17/04 12:00,2004,8,17,12,138.9,39.4785,150,100,100,20,150,150,80,7.7999,5.3962,-5.579,6.0892,16.1716,8.9002,3.4504,6.4196,-0.0562,-0.0212,13.3789,12.7212,11.3946
119,2004227N12338,DANIELLE,24.6,319.7,2368,HU,85,2,13,345,8/17/04 18:00,2004,8,17,18,138.9,37.7963,90,60,60,10,90,120,20,8.2043,3.6888,-3.8293,6.0948,17.1133,8.6167,3.1374,5.3372,-0.0664,-0.0251,12.0336,13.9759,14.0279
120,2004227N12338,DANIELLE,25.9,319.4,2364,HU,75,1,14,0,8/18/04 00:00,2004,8,18,0,138.9,41.6098,120,92.5,92.5,80,120,110,60,9.1019,5.8414,-4.271,5.1486,16.6946,10.2292,-0.0402,5.8145,0.5456,0.206,13.3729,16.7348,14.7434
121,2004227N12338,DANIELLE,27.3,319.7,2308,HU,65,1,12,20,8/18/04 06:00,2004,8,18,6,115.75,32.9008,120,95,95,60,170,120,30,10.9976,4.6698,-3.9818,4.9358,17.6126,9.6232,2.0788,4.3834,-0.0923,-0.0349,14.9794,15.5338,16.2724
122,2004227N12338,DANIELLE,28.1,320.2,2247,TS,55,0,10,40,8/18/04 12:00,2004,8,18,12,97.23,21.8656,170,190,190,50,170,200,340,14.5038,4.635,-1.7483,5.11,15.9647,6.4395,1.1671,3.8763,0.2209,0.0837,16.2521,14.7976,19.4672
123,2004227N12338,DANIELLE,28.9,321.1,2152,TS,45,0,11,60,8/18/04 18:00,2004,8,18,18,81.025,20.321,170,182.5,182.5,50,170,170,340,14.488,6.0006,-0.6945,4.3987,13.5224,5.3008,0.5466,3.3174,0.0218,0.0083,15.1825,12.9758,18.9343
124,2004227N12338,DANIELLE,29.3,322.2,2044,TS,40,0,7,55,8/19/04 00:00,2004,8,19,0,97.23,13.9194,410,257.5,257.5,350,100,410,170,17.0257,4.9763,-0.9963,3.3873,10.7294,4.9762,-1.7761,3.3556,0.1192,0.0452,18.022,12.5055,18.088
125,2004227N12338,DANIELLE,29.7,322.3,2033,TS,40,0,3,350,8/19/04 06:00,2004,8,19,6,83.34,12.8636,290,312.5,312.5,290,270,340,350,17.6462,4.6699,-1.1556,2.6916,11.0882,4.5403,-0.4475,2.7516,-0.0908,-0.0345,18.8018,11.5357,19.6015
126,2004227N12338,DANIELLE,29.9,322.3,2033,TS,35,0,2,65,8/19/04 12:00,2004,8,19,12,41.67,17.1656,250,295,295,250,400,250,280,17.5097,4.3555,-0.685,3.3672,9.2377,4.4339,-1.2146,3.8557,-0.216,-0.082,18.1947,10.4523,18.4026
127,2004227N12338,DANIELLE,29.9,322.8,1984,TS,35,0,5,105,8/19/04 18:00,2004,8,19,18,41.67,16.7519,290,275,275,350,110,350,290,18.5995,4.4499,-0.8566,3.145,7.6848,4.1907,-1.0544,4.3418,-0.1921,-0.0729,19.4561,8.7392,18.7661
128,2004227N12338,DANIELLE,29.8,323.2,1946,TS,35,0,2,25,8/20/04 00:00,2004,8,20,0,41.67,20.7913,250,327.5,327.5,250,490,260,310,18.2555,4.7332,-2.2592,3.8911,7.0977,4.6676,-1.1733,5.0497,-0.0363,-0.0138,20.5147,8.271,17.041
129,2004227N12338,DANIELLE,30.2,323,1966,TS,35,0,4,335,8/20/04 06:00,2004,8,20,6,41.67,24.3538,250,290,290,250,440,240,230,16.7892,6.7843,-2.1232,4.1776,4.8943,5.7406,-0.3416,5.1456,-0.0554,-0.0211,18.9124,5.2359,15.3375
130,2004227N12338,DANIELLE,30.5,322.8,1986,TS,35,0,5,325,8/20/04 12:00,2004,8,20,12,41.67,22.6995,250,277.5,277.5,250,330,280,250,12.7704,7.8352,-2.6954,4.459,3.0133,8.5913,0.1118,5.9523,-0.1071,-0.0407,15.4658,2.9015,10.4234
131,2004227N12338,DANIELLE,30.9,322.4,2026,TD,30,-1,4,305,8/20/04 18:00,2004,8,20,18,,21.2477,210,215,215,240,240,170,210,11.51,8.9057,-1.6558,3.7608,2.6523,5.7615,-0.3506,6.4566,0.0911,0.0347,13.1658,3.0029,10.1191
132,2004227N12338,DANIELLE,30.9,322,2064,TD,30,-1,5,245,8/21/04 00:00,2004,8,21,0,,21.564,170,212.5,212.5,280,210,190,170,11.1798,6.4874,-2.1911,3.5417,1.0124,4.0698,-1.3407,6.0361,0.2563,0.0975,13.3709,2.3531,8.6568
133,2004227N12338,DANIELLE,30.6,321.4,2120,TD,30,-1,4,255,8/21/04 06:00,2004,8,21,6,,18.8835,190,215,215,230,270,170,190,10.9094,4.9995,-2.0944,3.0507,0.6518,3.2945,-0.5344,5.648,0.4518,0.172,13.0038,1.1862,8.7674
134,2004227N12338,DANIELLE,30.7,321.1,2149,TD,25,-1,2,265,8/21/04 12:00,2004,8,21,12,,18.7822,190,207.5,207.5,260,180,200,190,8.7306,4.4357,-1.9767,2.9093,3.8993,3.0028,-0.2648,6.2508,0.4117,0.1568,10.7073,4.1641,7.5674
135,2004227N12338,DANIELLE,30.5,320.8,2157,LO,25,-3,5,240,8/21/04 18:00,2004,8,21,18,,17.6338,220,227.5,227.5,280,190,220,220,10.3071,4.3805,-1.9363,2.7172,7.5834,2.3329,-0.6003,5.6608,0.4551,0.1732,12.2434,8.1837,10.769
136,2004227N12338,DANIELLE,30.3,320.2,2149,LO,25,-3,5,250,8/22/04 00:00,2004,8,22,0,,17.0888,210,207.5,207.5,220,220,180,210,10.6454,4.4024,-2.9703,2.375,5.781,2.6123,-0.5399,5.4937,0.3752,0.1429,13.6157,6.3209,9.0948
137,2004227N12338,DANIELLE,30.2,319.7,2136,LO,25,-3,4,270,8/22/04 06:00,2004,8,22,6,,16.4605,200,265,265,200,170,210,480,9.3495,3.9339,-2.4209,2.3084,6.213,2.3916,0.9345,5.0812,0.3887,0.1482,11.7704,5.2785,8.6306
138,2004227N12338,DANIELLE,30.3,319.2,2104,LO,25,-3,4,285,8/22/04 12:00,2004,8,22,12,,17.5206,220,230,230,220,190,210,300,9.3683,3.9283,-2.1222,2.5709,6.2703,2.5614,0.9615,5.0326,0.3512,0.1339,11.4905,5.3088,8.9432
139,2004227N12338,DANIELLE,30.4,318.8,2077,LO,25,-3,6,290,8/22/04 18:00,2004,8,22,18,,16.5136,140,255,255,140,180,210,490,8.3702,4.2603,-2.5484,2.6954,8.059,2.0916,1.5059,4.6685,0.4741,0.1807,10.9186,6.5531,8.6592
140,2004227N12338,DANIELLE,30.8,318,2003,LO,25,-3,9,320,8/23/04 00:00,2004,8,23,0,,18.9952,200,242.5,242.5,200,190,220,360,10.6364,4.1735,-3.4119,2.8024,6.3663,1.9378,1.897,4.4974,0.5032,0.1919,14.0483,4.4693,8.4923
141,2004227N12338,DANIELLE,31.7,317.5,1892,LO,25,-3,10,325,8/23/04 06:00,2004,8,23,6,,17.6496,190,222.5,222.5,190,190,250,260,7.0118,4.5556,-2.4561,2.3697,6.2536,2.3806,3.3874,3.8986,0.3559,0.1358,9.4679,2.8662,5.2112
142,2004227N12338,DANIELLE,32.3,316.7,1799,LO,25,-3,9,320,8/23/04 12:00,2004,8,23,12,,19.5577,220,215,215,210,220,190,240,6.6529,4.7161,-2.9948,2.8111,8.8581,4.2625,2.8059,3.7849,0.4557,0.174,9.6477,6.0522,6.9743
143,2004227N12338,DANIELLE,33.1,316.2,1699,LO,25,-3,9,335,8/23/04 18:00,2004,8,23,18,,21.0571,140,130,130,140,160,10,210,8.1009,3.7661,-2.4415,2.5281,9.7979,4.5261,4.7487,3.9116,0.3268,0.1246,10.5424,5.0492,7.3735
144,2004227N12338,DANIELLE,33.9,315.8,1602,LO,20,-3,9,340,8/24/04 00:00,2004,8,24,0,,17.9873,160,110,110,160,130,10,140,9.6303,3.8405,-2.1004,2.0543,8.6076,3.2607,4.2403,3.1374,0.2863,0.1092,11.7307,4.3673,8.1844
145,2004227N12338,DANIELLE,34.7,315.4,1506,LO,20,-3,9,335,8/24/04 06:00,2004,8,24,6,,17.8162,230,152.5,152.5,230,140,20,220,8.9438,3.5956,-0.7431,2.1362,8.7058,4.4068,4.2531,3.0318,0.2945,0.1125,9.6869,4.4527,8.1638
146,2004227N12338,DANIELLE,35.5,315,1410,LO,20,-3,9,345,8/24/04 12:00,2004,8,24,12,,18.7621,220,317.5,317.5,220,240,500,310,10.151,3.8821,-1.3421,2.0849,6.4229,5.498,4.9566,3.1866,0.1594,0.0609,11.4931,1.4663,6.8773
147,2004227N12338,DANIELLE,36.4,314.8,1313,LO,20,-3,9,350,8/24/04 18:00,2004,8,24,18,,18.9839,250,350,350,250,170,490,490,9.8561,4.3864,1.1242,1.918,4.8707,7.3179,5.2397,3.0037,0.0599,0.0229,8.7319,-0.369,5.635
148,2004238N11325,FRANCES,11.1,324.8,1649,TD,25,-1,16,275,8/25/04 00:00,2004,8,25,0,,23.583,260,252.5,252.5,260,490,10,250,-9.189,2.5916,-5.1462,4.7658,0.4308,5.111,-2.7869,4.2832,-0.0847,-0.0319,-4.0428,3.2177,3.3467
149,2004238N11325,FRANCES,11.2,323.2,1614,TD,30,-1,15,275,8/25/04 06:00,2004,8,25,6,,24.8644,290,197.5,197.5,290,20,30,450,-9.9639,4.3073,-4.6757,5.1338,0.5937,5.4611,-2.5797,4.6782,-0.0726,-0.0274,-5.2882,3.1734,4.6414
150,2004238N11325,FRANCES,11.3,321.7,1599,TD,30,-1,15,275,8/25/04 12:00,2004,8,25,12,,22.0615,300,305,305,300,10,430,480,-11.5142,3.6934,-6.1581,5.3059,1.5882,5.2632,-1.5768,4.5244,-0.2094,-0.0789,-5.3561,3.165,5.2664
151,2004238N11325,FRANCES,11.5,320.2,1501,TS,35,0,16,280,8/25/04 18:00,2004,8,25,18,55.56,23.9902,310,300,300,310,220,500,170,-10.3113,2.7858,-5.8475,4.5084,2.1344,4.8116,0.1021,3.8923,-0.06,-0.0226,-4.4638,2.0323,4.6815
152,2004238N11325,FRANCES,11.9,318.5,1374,TS,40,0,16,285,8/26/04 00:00,2004,8,26,0,74.08,26.8524,330,327.5,327.5,330,270,480,230,-9.6033,3.5127,-6.7894,4.0594,1.5911,5.0476,0.6189,4.8886,-0.139,-0.0524,-2.8139,0.9722,2.9167
153,2004238N11325,FRANCES,12.3,317.1,1287,TS,45,0,15,285,8/26/04 06:00,2004,8,26,6,92.6,23.3586,300,242.5,242.5,300,90,360,220,-8.2058,3.7273,-6.2253,4.5047,1.6638,5.8582,1.4074,4.9188,-0.1786,-0.0674,-1.9805,0.2564,1.9904
154,2004238N11325,FRANCES,12.8,315.5,1210,TS,55,0,15,290,8/26/04 12:00,2004,8,26,12,106.49,23.69,270,265,265,390,160,240,270,-8.0582,3.9032,-6.0674,5.142,0.7801,5.1158,1.8772,5.1543,-0.16,-0.0604,-1.9908,-1.0971,1.7447
155,2004238N11325,FRANCES,13.3,314.2,1174,HU,65,1,12,290,8/26/04 18:00,2004,8,26,18,115.75,23.1278,310,292.5,292.5,310,160,450,250,-7.376,3.1509,-4.9799,5.3852,2.0406,4.9047,2.3074,5.769,-0.0285,-0.0107,-2.3961,-0.2668,2.1646
156,2004238N11325,FRANCES,13.7,313.2,1145,HU,70,1,11,295,8/27/04 00:00,2004,8,27,0,125.01,22.0877,270,285,285,250,220,400,270,-6.5016,3.0442,-5.0969,5.4904,2.5966,5.1118,0.8049,6.4106,0.0766,0.0289,-1.4047,1.7917,1.8409
157,2004238N11325,FRANCES,14.2,312.2,1137,HU,75,1,10,300,8/27/04 06:00,2004,8,27,6,125.01,22.2055,150,122.5,122.5,150,90,160,90,-3.9832,2.7982,-5.0942,5.776,2.4986,4.201,2.0082,6.4925,0.1277,0.0482,1.111,0.4904,-0.7737
158,2004238N11325,FRANCES,14.7,311.5,1153,HU,90,2,9,310,8/27/04 12:00,2004,8,27,12,134.27,23.7912,110,107.5,107.5,90,110,160,70,-3.0339,3.4822,-5.0575,6.252,1.8195,5.768,2.1557,7.3043,0.2361,0.0891,2.0236,-0.3362,-1.9601
159,2004238N11325,FRANCES,15.4,310.7,1191,HU,100,3,9,310,8/27/04 18:00,2004,8,27,18,157.42,26.8275,90,117.5,117.5,90,110,180,90,-3.1403,4.5303,-3.1418,7.2402,3.5849,6.7661,3.0253,7.4142,0.4489,0.1694,0.0015,0.5596,0.4042
160,2004238N11325,FRANCES,15.9,310,1210,HU,100,3,10,305,8/28/04 00:00,2004,8,28,0,157.42,28.7082,140,132.5,132.5,140,100,160,130,-3.6335,3.4763,-3.0464,7.2074,5.0018,5.9041,2.1149,7.1778,0.3799,0.1434,-0.5871,2.8869,2.4737
161,2004238N11325,FRANCES,16.6,309.1,1251,HU,100,3,10,310,8/28/04 06:00,2004,8,28,6,166.68,29.6651,70,82.5,82.5,70,90,130,40,-1.4396,4.2905,-3.728,7.2546,6.5357,5.7219,1.8377,6.7654,0.3227,0.1217,2.2884,4.698,2.536
162,2004238N11325,FRANCES,17.2,308.4,1248,HU,105,3,9,310,8/28/04 12:00,2004,8,28,12,166.68,30.6448,80,97.5,97.5,80,100,130,80,-1.5547,5.3085,-4.2001,8.483,5.1313,6.277,1.9594,8.0591,0.8756,0.3301,2.6454,3.1719,0.727
163,2004238N11325,FRANCES,17.7,307.7,1221,HU,115,4,8,305,8/28/04 18:00,2004,8,28,18,171.31,35.0985,90,92.5,92.5,90,80,110,90,-2.5373,4.965,-3.3995,8.9681,5.6129,6.7365,2.949,7.6037,0.7101,0.2676,0.8622,2.6639,1.6594
164,2004238N11325,FRANCES,18.1,307.1,1202,HU,115,4,7,300,8/29/04 00:00,2004,8,29,0,194.46,37.2981,70,75,75,70,60,110,60,-2.8147,5.6319,-3.6898,8.0024,5.8429,6.6851,1.8449,7.1544,0.5757,0.217,0.8751,3.998,2.3602
165,2004238N11325,FRANCES,18.4,306.4,1173,HU,115,4,8,290,8/29/04 06:00,2004,8,29,6,203.72,39.895,60,75,75,60,60,90,90,-1.7361,6.554,-4.2381,8.9125,5.0005,7.5385,1.3787,8.0728,0.9468,0.3567,2.502,3.6218,0.8366
166,2004238N11325,FRANCES,18.6,305.6,1133,HU,115,4,7,285,8/29/04 12:00,2004,8,29,12,226.87,43.8296,70,67.5,67.5,70,90,50,60,-2.2776,6.0585,-5.4371,10.0483,6.6783,9.0119,0.9056,8.7175,1.0602,0.3994,3.1595,5.7727,1.544
167,2004238N11325,FRANCES,18.8,305,1112,HU,110,3,7,285,8/29/04 18:00,2004,8,29,18,240.76,47.9119,60,72.5,72.5,60,80,90,60,-1.7586,5.6693,-5.4176,10.4335,6.5434,8.0608,2.1051,8.6614,1.4167,0.5333,3.659,4.4383,0.9634
168,2004238N11325,FRANCES,18.9,304.2,1033,HU,105,3,8,275,8/30/04 00:00,2004,8,30,0,240.76,52.0966,60,60,60,60,100,40,40,-3.2426,6.4715,-6.0675,10.7289,5.1565,7.7596,0.7451,10.1106,1.6275,0.611,2.8249,4.4114,-0.0218
169,2004238N11325,FRANCES,19,303.2,929,HU,100,3,11,280,8/30/04 06:00,2004,8,30,6,240.76,47.4997,80,62.5,62.5,80,60,50,60,-3.4564,5.6566,-6.0686,10.742,4.2573,7.093,0.9567,9.3739,1.8035,0.6779,2.6122,3.3006,-0.6598
170,2004238N11325,FRANCES,19.2,301.9,794,HU,100,3,12,280,8/30/04 12:00,2004,8,30,12,245.39,60.2458,60,72.5,72.5,60,110,60,60,-8.0335,5.3206,-7.483,10.8676,5.711,9.3292,0.2717,10.5969,2.1215,0.7971,-0.5505,5.4393,2.3687
171,2004238N11325,FRANCES,19.4,300.7,672,HU,110,3,12,280,8/30/04 18:00,2004,8,30,18,259.28,55.7554,60,62.5,62.5,70,80,40,60,-9.7289,5.869,-5.9117,11.4496,5.7473,7.8641,0.6795,11.0453,2.3439,0.8811,-3.8172,5.0678,5.3491
172,2004238N11325,FRANCES,19.6,299.3,532,HU,110,3,13,280,8/31/04 00:00,2004,8,31,0,263.91,60.582,40,37.5,37.5,40,40,30,40,-9.7689,5.6404,-8.8169,10.2829,4.9463,6.6531,0.4645,10.1427,2.0191,0.7569,-0.952,4.4818,2.1206
173,2004238N11325,FRANCES,19.8,297.9,399,HU,115,4,13,280,8/31/04 06:00,2004,8,31,6,263.91,58.3351,80,72.5,72.5,80,80,60,70,-9.4802,6.4824,-8.1428,10.5901,6.6017,7.1671,1.5211,9.9975,1.9943,0.75,-1.3374,5.0806,3.2687
174,2004238N11325,FRANCES,20,296.5,284,HU,120,4,14,280,8/31/04 12:00,2004,8,31,12,263.91,54.9428,90,72.5,72.5,90,60,60,80,-10.8751,7.2483,-8.2258,12.1489,6.1263,8.8333,1.1635,11.6552,2.7292,1.0247,-2.6493,4.9628,4.1743
175,2004238N11325,FRANCES,20.3,295,221,HU,125,4,14,280,8/31/04 18:00,2004,8,31,18,263.91,62.2789,80,70,70,80,60,60,80,-9.4596,6.9316,-7.7057,12.819,6.0212,7.7814,2.5415,11.7185,2.6786,1.0062,-1.7539,3.4797,3.0993
176,2004238N11325,FRANCES,20.6,293.6,246,HU,120,4,14,285,9/1/04 00:00,2004,9,1,0,263.91,62.6231,60,57.5,57.5,60,60,50,60,-8.2406,7.4664,-8.5805,12.386,4.855,7.9383,2.1799,12.4984,2.9131,1.0924,0.3399,2.6751,0.7114
177,2004238N11325,FRANCES,21,292.1,239,HU,120,4,14,290,9/1/04 06:00,2004,9,1,6,263.91,66.6642,70,60,60,70,70,50,50,-8.3857,6.8385,-8.0317,12.6522,6.0702,7.5041,3.2853,12.0123,3.0194,1.1326,-0.354,2.7849,1.6745
178,2004238N11325,FRANCES,21.4,290.9,222,HU,120,4,12,285,9/1/04 12:00,2004,9,1,12,263.91,64.4375,40,52.5,52.5,40,50,60,60,-5.1803,8.506,-7.639,13.5193,6.514,10.2308,3.4188,13.5085,3.2027,1.1992,2.4587,3.0952,-0.0464
179,2004238N11325,FRANCES,21.8,289.6,224,HU,120,4,11,290,9/1/04 18:00,2004,9,1,18,263.91,62.4592,90,77.5,77.5,90,90,60,70,-3.8905,7.7396,-6.4243,12.943,5.4862,9.2308,4.2833,13.0894,3.0352,1.1404,2.5338,1.2029,-0.9956
180,2004238N11325,FRANCES,22.2,288.6,199,HU,120,4,11,295,9/2/04 00:00,2004,9,2,0,263.91,66.2534,70,62.5,62.5,70,60,60,60,-1.7595,7.4611,-6.5347,14.0263,2.7256,8.8653,3.3991,13.5562,3.2514,1.2176,4.7752,-0.6735,-4.1217
181,2004238N11325,FRANCES,22.7,287.5,175,HU,125,4,12,295,9/2/04 06:00,2004,9,2,6,263.91,63.3226,60,67.5,67.5,60,60,80,70,-0.079,6.0871,-7.0511,14.1782,3.4432,8.0894,2.4785,14.2121,3.769,1.412,6.9721,0.9647,-4.0299
182,2004238N11325,FRANCES,23.2,286.5,225,HU,120,4,10,305,9/2/04 12:00,2004,9,2,12,263.91,69.2587,60,77.5,77.5,60,100,80,70,2.4559,7.276,-7.1504,14.2365,3.3788,8.2774,3.3203,15.2146,3.598,1.3484,9.6063,0.0585,-3.7066
183,2004238N11325,FRANCES,23.8,285.7,308,HU,115,4,10,315,9/2/04 18:00,2004,9,2,18,268.54,63.5469,50,65,65,60,80,70,50,4.0751,7.5067,-6.2842,14.2804,3.6186,8.2538,4.4766,15.3336,3.9555,1.48,10.3593,-0.858,-2.2658
184,2004238N11325,FRANCES,24.2,285,275,HU,105,3,6,290,9/3/04 00:00,2004,9,3,0,273.17,65.703,80,75,75,90,50,80,80,5.2044,7.5814,-5.6962,14.606,1.815,9.27,2.4118,16.2526,4.0628,1.5207,10.9006,-0.5968,-0.6739
185,2004238N11325,FRANCES,24.7,284.3,203,HU,100,3,10,320,9/3/04 06:00,2004,9,3,6,268.54,69.2492,90,90,90,90,70,110,90,6.3321,7.5777,-6.2868,15.1835,3.9093,8.124,3.6318,15.7793,3.6164,1.3556,12.6189,0.2775,0.1812
186,2004238N11325,FRANCES,25.3,283.7,165,HU,95,2,8,310,9/3/04 12:00,2004,9,3,12,275.485,66.3157,70,80,80,70,80,90,80,6.6072,6.9802,-5.5901,15.2938,1.6762,7.5912,2.8273,14.8843,3.912,1.4649,12.1973,-1.1511,0.5521
187,2004238N11325,FRANCES,25.7,282.9,112,HU,90,2,7,300,9/3/04 18:00,2004,9,3,18,277.8,64.4354,60,77.5,77.5,80,110,60,60,7.0841,6.8325,-6.0351,15.0536,2.4476,8.5571,1.82,16.7393,3.4202,1.2798,13.1192,0.6276,1.1915
188,2004238N11325,FRANCES,26,282.5,112,HU,85,2,5,315,9/4/04 00:00,2004,9,4,0,284.745,58.7431,100,105,105,100,130,100,90,7.6677,5.4059,-6.3348,14.9689,-1.1232,7.9541,2.0519,16.4748,3.3409,1.2523,14.0025,-3.1751,1.0907
189,2004238N11325,FRANCES,26.4,282.1,145,HU,85,2,5,315,9/4/04 06:00,2004,9,4,6,284.745,58.9181,70,80,80,60,110,80,70,8.5057,6.802,-6.9417,15.4642,0.9993,9.0075,2.9035,15.9251,3.3553,1.2544,15.4474,-1.9042,1.0397
190,2004238N11325,FRANCES,26.8,281.5,148,HU,90,2,8,295,9/4/04 12:00,2004,9,4,12,284.745,55.7299,80,85,85,80,90,90,80,6.5998,7.6777,-4.8542,15.8311,2.5347,11.1811,1.4904,16.2321,3.3022,1.2364,11.454,1.0443,1.992
191,2004238N11325,FRANCES,26.8,280.9,89,HU,90,2,3,275,9/4/04 18:00,2004,9,4,18,287.06,59.7054,80,77.5,77.5,80,80,80,70,2.8566,8.8328,-4.3884,16.393,2.5861,9.9311,0.8423,16.9273,3.4771,1.2999,7.245,1.7438,-0.6152
192,2004238N11325,FRANCES,27,280.6,63,HU,95,2,8,290,9/5/04 00:00,2004,9,5,0,287.06,61.5665,80,80,80,80,80,80,80,3.6439,9.2169,-4.1783,17.2597,3.1625,10.2044,0.5417,18.7035,3.7846,1.4147,7.8222,2.6208,0.6116
193,2004238N11325,FRANCES,27.2,279.8,0,HU,90,2,2,295,9/5/04 06:00,2004,9,5,6,287.06,56.9526,90,80,80,90,80,60,90,2.3188,9.3153,-6.0197,16.8338,2.3689,9.5217,1.1714,17.1984,2.9843,1.1152,8.3385,1.1975,-2.8177
194,2004238N11325,FRANCES,27.4,279.3,0,HU,80,1,8,295,9/5/04 12:00,2004,9,5,12,266.225,50.903,120,130,130,120,90,190,120,0.5546,9.1124,-5.4289,16.899,2.0051,8.2774,3.4718,17.3133,2.2213,0.8337,5.9835,-1.4667,-4.3637
195,2004238N11325,FRANCES,27.8,278.3,0,TS,60,0,8,295,9/5/04 18:00,2004,9,5,18,254.65,52.7178,140,140,140,140,160,130,130,-1.5664,8.5313,-5.271,17.0243,4.7995,7.0768,2.1707,17.3277,2.1675,0.8133,3.7046,2.6288,-0.6518
196,2004238N11325,FRANCES,28.1,277.7,0,TS,55,0,8,300,9/6/04 00:00,2004,9,6,0,277.8,44.5366,140,167.5,167.5,170,220,140,140,-2.1341,6.8087,-5.4398,16.1284,2.0598,6.3103,1.8195,17.8348,2.0271,0.761,3.3057,0.2403,-2.77
197,2004238N11325,FRANCES,28.6,276.7,66,TS,55,0,8,310,9/6/04 06:00,2004,9,6,6,254.65,41.397,130,197.5,197.5,280,270,110,130,-2.1252,6.3872,-5.7268,15.8465,2.4095,5.722,4.3501,15.8929,1.8502,0.6946,3.6016,-1.9406,-3.9788
198,2004238N11325,FRANCES,29.2,276.3,44,TS,55,0,8,340,9/6/04 12:00,2004,9,6,12,152.79,37.8117,150,195,195,270,150,190,170,-0.5529,6.176,-3.3164,16.9312,0.4098,5.283,5.6715,14.4033,1.8581,0.6981,2.7635,-5.2617,-5.8818
199,2004238N11325,FRANCES,30.1,276,0,TS,50,0,10,335,9/6/04 18:00,2004,9,6,18,111.12,41.6424,170,222.5,222.5,280,170,230,210,0.1457,7.383,-3.7761,16.4855,1.808,5.4742,5.3675,15.5488,2.0275,0.762,3.9218,-3.5595,-4.7488
200,2004238N11325,FRANCES,31,275.4,0,TS,35,0,8,325,9/7/04 00:00,2004,9,7,0,83.34,34.098,250,222.5,222.5,310,250,170,160,2.1233,6.4725,-4.3947,13.949,4.0129,5.2732,3.1176,15.5429,1.5597,0.5859,6.518,0.8953,-0.8482
201,2004238N11325,FRANCES,31.5,275,0,TD,30,-1,5,330,9/7/04 06:00,2004,9,7,6,,31.9192,370,280,280,380,370,200,170,3.5072,5.0708,-5.3864,13.8935,3.2869,5.393,3.5019,15.4124,1.6648,0.6267,8.8936,-0.215,-1.618
202,2004238N11325,FRANCES,32,274.8,0,TD,25,-1,5,355,9/7/04 12:00,2004,9,7,12,,31.0801,410,320,320,440,410,240,190,3.1241,3.7873,-2.5522,12.392,4.2355,3.787,2.8567,15.2919,1.6552,0.6247,5.6763,1.3788,1.4323
203,2004238N11325,FRANCES,32.5,274.9,0,TD,25,-1,7,20,9/7/04 18:00,2004,9,7,18,,28.2138,430,357.5,357.5,450,430,330,220,4.5641,2.9611,0.0281,11.6643,5.854,3.126,2.0761,13.2584,1.5976,0.6032,4.536,3.7779,5.3467
204,2004238N11325,FRANCES,33.4,275.3,0,TD,25,-1,9,20,9/8/04 00:00,2004,9,8,0,,26.6037,420,395,395,420,420,430,310,7.0882,2.4483,-2.2322,11.0911,7.0386,3.6924,-1.3914,13.6807,1.5496,0.5853,9.3204,8.43,7.3589
205,2004238N11325,FRANCES,34.3,275.7,0,TD,25,-1,15,25,9/8/04 06:00,2004,9,8,6,,28.5194,440,360,360,220,440,480,300,8.4507,2.7668,-4.1287,10.5372,7.554,4.2515,1.7908,13.4691,1.7171,0.6493,12.5794,5.7632,6.8344
206,2004238N11325,FRANCES,36.1,276.8,0,TD,25,-1,21,25,9/8/04 12:00,2004,9,8,12,,23.6309,490,340,340,170,490,250,450,8.971,4.0551,-3.5276,9.9523,9.1963,5.933,2.1117,12.5752,1.8178,0.6893,12.4986,7.0846,8.7359
207,2004238N11325,FRANCES,37.8,277.9,0,TD,25,-1,14,30,9/8/04 18:00,2004,9,8,18,,27.0506,460,402.5,402.5,460,410,300,440,9.4788,4.5511,-5.2277,8.9795,12.117,7.806,3.3087,12.4767,1.9426,0.7384,14.7065,8.8083,9.1973
208,2004238N11325,FRANCES,38.7,278.7,0,EX,25,-4,15,30,9/9/04 00:00,2004,9,9,0,,27.6357,370,347.5,347.5,390,480,150,370,10.0174,4.534,-3.6759,9.0605,12.7479,6.1691,1.4876,13.6569,2.0174,0.7672,13.6933,11.2603,12.2474
209,2004238N11325,FRANCES,40.5,280,0,EX,30,-4,26,35,9/9/04 06:00,2004,9,9,6,,28.7298,210,305,305,230,490,290,210,13.5637,5.6694,-4.0612,8.9312,16.0787,6.0942,4.1962,14.0882,2.2762,0.8673,17.6249,11.8825,15.196
210,2004238N11325,FRANCES,42.8,282.3,0,EX,35,-4,25,40,9/9/04 12:00,2004,9,9,12,69.45,28.6635,100,210,210,100,490,150,100,17.323,6.0176,-4.6046,8.5784,20.0016,6.9688,5.6324,14.2385,2.1316,0.8122,21.9276,14.3692,19.1853
211,2004238N11325,FRANCES,44.3,284.3,0,EX,30,-4,19,50,9/9/04 18:00,2004,9,9,18,,25.8827,480,360,360,200,480,280,480,18.6944,5.6424,-2.4053,10.0529,21.5773,6.7137,7.1722,13.7795,2.6436,1.013,21.0997,14.4051,20.9845
212,2004238N11325,FRANCES,45.3,286.7,0,EX,25,-4,21,65,9/10/04 00:00,2004,9,10,0,,25.1121,350,332.5,332.5,440,350,370,170,22.1429,6.5313,1.2973,10.2448,20.1361,6.2955,6.02,13.2514,2.7467,1.0532,20.8456,14.1161,23.7712
213,2004238N11325,FRANCES,46.2,289.5,0,EX,20,-4,22,75,9/10/04 06:00,2004,9,10,6,,26.3855,310,302.5,302.5,420,310,380,100,25.6714,7.9904,4.1215,11.0222,19.5244,6.2368,6.2921,13.3502,2.6167,1.0035,21.5499,13.2323,24.7307
214,2004238N11325,FRANCES,46.6,292.7,0,EX,20,-4,22,80,9/10/04 12:00,2004,9,10,12,,28.351,480,322.5,322.5,480,290,260,260,27.5927,7.646,6.5865,11.6596,17.8247,5.8133,5.8311,12.6058,2.6007,0.999,21.0062,11.9936,24.0525
215,2004238N11325,FRANCES,47.2,295.8,23,EX,20,-4,22,70,9/10/04 18:00,2004,9,10,18,,28.4532,60,307.5,307.5,270,430,470,60,33.7131,7.7922,7.659,11.5171,16.4591,6.0393,1.9019,12.1128,2.3523,0.9037,26.0541,14.5572,29.6247
216,2004241N29295,HERMINE,29,294.8,1157,TD,25,-1,4,265,8/27/04 18:00,2004,8,27,18,,16.8172,360,265,265,360,70,270,360,2.6202,4.9341,-2.2834,2.6115,-0.3719,6.8727,-0.352,3.6287,-0.0928,-0.0353,4.9036,-0.0199,0.3361
217,2004241N29295,HERMINE,29,294.3,1136,TD,25,-1,4,275,8/28/04 00:00,2004,8,28,0,,17.667,500,335,335,500,390,300,150,0.736,5.9486,-2.6346,2.497,-0.072,7.1466,-1.3149,4.0239,-0.2439,-0.0927,3.3706,1.2429,-2.205
218,2004241N29295,HERMINE,29.1,293.8,1116,TD,25,-1,4,280,8/28/04 06:00,2004,8,28,6,,17.4279,470,257.5,257.5,470,260,190,110,-1.72,5.3454,-3.9622,2.6166,0.0669,5.998,0.407,3.5544,-0.1638,-0.0623,2.2422,-0.3401,-2.2617
219,2004241N29295,HERMINE,29.2,293.4,1100,TD,30,-1,5,310,8/28/04 12:00,2004,8,28,12,,16.7624,180,167.5,167.5,180,100,250,140,-6.7849,5.3407,-4.0023,3.1567,0.9468,6.3467,1.5256,4.0116,0.0247,0.0094,-2.7826,-0.5788,2.5674
220,2004241N29295,HERMINE,29.7,292.8,1030,TD,30,-1,10,300,8/28/04 18:00,2004,8,28,18,,16.4226,490,337.5,337.5,490,90,290,480,-7.6837,5.2763,-2.4119,3.1778,0.8853,4.8009,2.7769,4.4457,-0.0215,-0.0082,-5.2718,-1.8916,4.0564
221,2004241N29295,HERMINE,30.1,291.6,912,TD,30,-1,10,290,8/29/04 00:00,2004,8,29,0,,16.6685,300,220,220,300,200,120,260,-9.2033,5.1311,-3.1443,3.3815,-0.2128,5.5138,1.0738,4.4391,0.1078,0.0409,-6.059,-1.2866,5.8832
222,2004241N29295,HERMINE,30.5,290.8,824,TD,30,-1,8,310,8/29/04 06:00,2004,8,29,6,,19.007,240,305,305,240,210,490,280,-9.3968,5.9382,-3.941,3.2331,0.2138,4.3468,4.1849,3.8345,0.1303,0.0494,-5.4558,-3.9711,3.6508
223,2004241N29295,HERMINE,31.1,290.2,738,TS,35,0,9,320,8/29/04 12:00,2004,8,29,12,57.875,20.3616,200,265,265,200,190,490,180,-7.567,6.0513,-1.6325,4.3874,0.0284,5.3687,4.9961,3.8309,0.2668,0.1012,-5.9345,-4.9677,2.311
224,2004241N29295,HERMINE,31.8,289.5,639,TS,40,0,9,320,8/29/04 18:00,2004,8,29,18,57.875,19.8843,170,202.5,202.5,170,160,120,360,-6.7154,5.4526,-0.605,4.2082,0.3876,5.6096,5.1739,4.1555,0.2686,0.1018,-6.1104,-4.7863,1.5174
225,2004241N29295,HERMINE,32.6,288.9,538,TS,40,0,10,335,8/30/04 00:00,2004,8,30,0,92.6,21.7638,120,167.5,167.5,120,120,90,340,-2.1357,5.0076,-1.5392,4.0273,-0.7872,5.6049,6.2976,3.6393,0.2393,0.0906,-0.5965,-7.0848,-4.2068
226,2004241N29295,HERMINE,33.8,288.5,427,TS,50,0,17,355,8/30/04 06:00,2004,8,30,6,83.34,22.7129,170,325,325,170,160,490,480,-3.3974,4.3707,0.5171,3.4588,-0.2409,6.205,8.684,3.0699,0.1707,0.0647,-3.9145,-8.9249,-5.2935
227,2004241N29295,HERMINE,35.8,288.5,359,TS,45,0,19,0,8/30/04 12:00,2004,8,30,12,69.45,23.8135,480,222.5,222.5,140,140,480,130,-0.6275,5.2134,1.3471,4.2745,3.5916,6.9546,8.9244,3.259,0.2964,0.1124,-1.9746,-5.3328,-5.3795
228,2004241N29295,HERMINE,37.6,288.6,328,TS,45,0,21,0,8/30/04 18:00,2004,8,30,18,57.875,25.3152,480,202.5,202.5,140,100,480,90,4.3934,4.5997,1.6346,4.155,5.34,6.875,9.647,3.4541,0.3286,0.1246,2.7588,-4.307,-2.8695
229,2004241N29295,HERMINE,39.9,288.7,148,TS,35,0,20,5,8/31/04 00:00,2004,8,31,0,18.52,28.6212,480,305,305,360,370,480,10,11.5639,6.2351,2.0641,3.9674,3.7456,8.329,10.1486,4.5317,1.067,0.406,9.4998,-6.403,1.799
230,2004241N29295,HERMINE,41.5,289.1,8,TS,35,0,16,10,8/31/04 06:00,2004,8,31,6,11.575,35.0992,490,285,285,170,470,490,10,16.0951,11.1901,4.6964,3.5404,8.045,11.2829,9.6194,5.9999,1.2165,0.4642,11.3987,-1.5744,7.2891
231,2004241N29295,HERMINE,43.1,289.5,19,EX,25,-4,17,10,8/31/04 12:00,2004,8,31,12,,33.0099,490,417.5,417.5,220,480,490,480,23.3353,10.2592,7.1288,4.1593,15.104,13.0015,3.7668,8.9468,1.736,0.6661,16.2065,11.3372,19.7341
232,2004241N32282,GASTON,31.8,281.9,180,TD,25,-1,2,160,8/27/04 12:00,2004,8,27,12,,14.6978,80,230,230,480,140,80,220,1.0901,4.9583,0.6652,3.5496,-4.2945,6.761,0.3595,3.2788,0.1637,0.0622,0.4249,-4.654,3.6746
233,2004241N32282,GASTON,31.6,282,204,TD,25,-1,2,165,8/27/04 18:00,2004,8,27,18,,13.8063,420,225,225,420,60,240,180,1.9863,5.9838,0.2529,4.1043,-2.7405,7.2134,-1.2252,2.9575,0.1311,0.0497,1.7334,-1.5153,2.1336
234,2004241N32282,GASTON,31.4,282,221,TD,30,-1,2,210,8/28/04 00:00,2004,8,28,0,,12.7943,400,202.5,202.5,400,70,160,180,3.7366,4.9246,-0.8193,3.2304,-3.2505,7.5486,-1.9869,2.9524,0.0982,0.0372,4.5559,-1.2636,2.8034
235,2004241N32282,GASTON,31.3,281.8,220,TS,35,0,2,260,8/28/04 06:00,2004,8,28,6,23.15,16.2933,70,135,135,70,70,180,220,2.6155,5.5939,-1.4858,3.7093,-3.6366,5.8901,-0.8357,3.9191,0.2587,0.0981,4.1013,-2.8009,2.7748
236,2004241N32282,GASTON,31.3,281.5,202,TS,45,0,3,270,8/28/04 12:00,2004,8,28,12,46.3,23.3167,120,127.5,127.5,100,120,170,120,2.655,6.8542,-1.4017,4.6155,-0.3514,7.6387,0.0414,5.3157,0.5902,0.2238,4.0567,-0.3928,1.2758
237,2004241N32282,GASTON,31.3,281.2,183,TS,50,0,3,285,8/28/04 18:00,2004,8,28,18,106.49,26.123,110,122.5,122.5,110,120,140,120,4.775,4.6296,-0.2813,5.2441,2.2057,7.6955,0.8107,5.3806,0.518,0.1963,5.0563,1.395,4.4017
238,2004241N32282,GASTON,31.5,280.9,149,TS,55,0,5,325,8/29/04 00:00,2004,8,29,0,92.6,27.6322,110,102.5,102.5,110,100,90,110,5.4628,4.9301,-1.1522,5.9127,0.0664,7.1231,1.1682,6.3516,0.763,0.2885,6.615,-1.1018,3.8224
239,2004241N32282,GASTON,32.1,280.6,79,TS,60,0,7,350,8/29/04 06:00,2004,8,29,6,87.97,29.082,100,97.5,97.5,100,150,70,70,1.9871,5.1516,0.0495,6.3939,2.4923,7.2997,2.0675,6.7231,0.8191,0.31,1.9376,0.4248,1.1194
240,2004241N32282,GASTON,32.8,280.5,21,HU,65,1,7,345,8/29/04 12:00,2004,8,29,12,74.08,29.753,130,115,115,120,130,120,90,1.4706,5.5403,-0.1027,6.8041,6.0772,7.1017,1.8258,7.1726,0.9438,0.3573,1.5733,4.2514,4.4239
241,2004241N32282,GASTON,33.5,280.4,0,TS,45,0,7,5,8/29/04 18:00,2004,8,29,18,27.78,28.8995,110,100,100,100,110,110,80,3.3572,4.6814,0.8314,6.9891,6.5812,6.8899,2.5708,6.5739,0.826,0.3124,2.5258,4.0104,4.6861
242,2004241N32282,GASTON,34.2,280.6,0,TD,30,-1,7,15,8/30/04 00:00,2004,8,30,0,,25.7578,130,137.5,137.5,190,130,160,70,3.5771,4.3695,0.3721,7.0971,4.3788,6.6478,2.0833,6.0667,0.6655,0.2516,3.205,2.2955,3.5379
243,2004241N32282,GASTON,34.9,280.9,0,TD,30,-1,7,20,8/30/04 06:00,2004,8,30,6,,25.1895,150,187.5,187.5,250,150,290,60,3.325,4.6784,1.0516,6.6487,5.7176,5.8674,3.725,6.3849,0.7382,0.2796,2.2734,1.9926,2.7435
244,2004241N32282,GASTON,35.6,281.3,0,TD,25,-1,9,35,8/30/04 12:00,2004,8,30,12,,25.3579,210,205,205,300,210,250,60,5.7094,4.8873,2.9027,6.8949,5.9756,5.4138,2.8162,6.6003,0.8879,0.3368,2.8067,3.1594,4.2204
245,2004241N32282,GASTON,36.4,282.2,0,TD,30,-1,12,45,8/30/04 18:00,2004,8,30,18,,25.3152,200,182.5,182.5,160,200,290,80,7.0093,5.0377,3.0805,6.8848,7.4002,7.5435,2.9514,6.6435,1.0208,0.3869,3.9288,4.4488,5.9266
246,2004241N32282,GASTON,37.2,283.4,0,TS,35,0,15,55,8/31/04 00:00,2004,8,31,0,20.835,28.9609,100,152.5,152.5,90,100,320,100,8.1175,5.7573,4.2049,6.3405,6.6061,9.4028,2.8726,8.0971,0.9891,0.3747,3.9126,3.7335,5.3734
247,2004241N32282,GASTON,38.1,285.2,34,TS,35,0,17,55,8/31/04 06:00,2004,8,31,6,20.835,35.7211,90,102.5,102.5,110,90,90,120,10.1602,6.5917,6.5676,5.6016,7.8376,9.503,4.5813,8.8723,0.9497,0.3596,3.5926,3.2563,4.8243
248,2004241N32282,GASTON,39.1,287.1,128,TS,35,0,20,55,8/31/04 12:00,2004,8,31,12,20.835,34.3813,110,100,100,70,110,140,80,14.8091,7.0775,7.9065,5.9652,9.4289,9.8469,1.9775,8.9522,1.2045,0.4567,6.9026,7.4514,9.406
249,2004241N32282,GASTON,40.2,289.5,145,TS,35,0,22,65,8/31/04 18:00,2004,8,31,18,97.23,36.0916,130,170,170,360,130,130,60,17.8196,8.1352,8.3015,5.7514,13.0264,10.7076,2.5851,9.3984,1.3783,0.5235,9.5181,10.4413,13.3785
250,2004241N32282,GASTON,41,292.5,222,TS,40,0,28,75,9/1/04 00:00,2004,9,1,0,125.01,38.2313,160,137.5,137.5,110,160,170,110,20.5797,8.1271,10.0338,6.3506,11.5238,10.668,3.5207,10.3724,1.6764,0.6364,10.5459,8.0031,12.9529
251,2004241N32282,GASTON,41.7,296.5,248,TS,45,0,31,75,9/1/04 06:00,2004,9,1,6,138.9,37.2088,60,75,75,40,60,80,120,23.4484,9.0505,12.4455,5.92,9.023,10.1758,3.5618,10.3724,1.2621,0.4778,11.0029,5.4612,12.1794
252,2004241N32282,GASTON,43,300.4,272,EX,45,-4,35,60,9/1/04 12:00,2004,9,1,12,138.9,37.839,140,120,120,90,140,160,90,27.1096,7.6152,13.9533,6.446,10.8707,11.4851,1.8003,10.9458,1.2539,0.4767,13.1563,9.0704,15.139
253,2004241N32282,GASTON,45,305,207,EX,45,-4,40,60,9/1/04 18:00,2004,9,1,18,263.91,38.8144,230,235,235,380,230,230,100,32.0046,8.1523,13.1195,7.9499,16.0584,11.2179,3.9645,9.3645,2.3444,0.8979,18.8851,12.0939,22.1019
254,2004241N32282,GASTON,47,310,203,EX,45,-4,42,65,9/2/04 00:00,2004,9,2,0,222.24,39.0176,270,377.5,377.5,400,270,340,500,38.3626,7.3409,14.3461,7.2333,18.1874,8.5537,2.6322,8.766,2.2313,0.8614,24.0165,15.5552,27.8699
255,2004241N32282,GASTON,48.5,316,646,EX,45,-4,43,70,9/2/04 06:00,2004,9,2,6,222.24,36.4917,270,355,355,500,270,280,370,41.6478,6.7991,13.2496,10.7621,16.5341,8.4355,3.1809,8.5154,2.6879,1.0408,28.3982,13.3532,31.1837
256,2004241N32282,GASTON,50,322,1092,EX,45,-4,42,70,9/2/04 12:00,2004,9,2,12,222.24,38.1575,230,305,305,430,230,310,250,45.8819,7.239,12.455,12.1692,13.4086,9.3142,3.1593,7.287,2.6827,1.0403,33.4269,10.2493,34.9516
257,2004241N32282,GASTON,51.1,328,1211,EX,40,-4,30,70,9/2/04 18:00,2004,9,2,18,222.24,35.5352,250,340,340,480,250,230,400,47.0147,7.1518,14.0109,11.0426,11.2803,9.4193,3.6652,5.3434,2.6041,1.011,33.0038,7.6151,33.8666
258,2004241N32282,GASTON,52,331.1,1248,EX,35,-4,18,60,9/3/04 00:00,2004,9,3,0,222.24,32.9366,480,412.5,412.5,440,480,250,480,47.804,8.1436,12.6239,8.5111,14.4229,8.9829,3.4391,2.7764,2.1019,0.8178,35.1801,10.9838,36.8484
259,2004247N10332,IVAN,9.7,332.4,1217,TD,25,-1,10,270,9/2/04 18:00,2004,9,2,18,,22.3875,200,220,220,200,220,160,300,-6.2172,6.6391,-0.9372,6.5111,-2.5386,5.9226,-2.4943,5.9589,0.1647,0.0622,-5.28,-0.0443,4.051
260,2004247N10332,IVAN,9.7,331.3,1334,TD,30,-1,13,270,9/3/04 00:00,2004,9,3,0,,24.4723,90,137.5,137.5,200,130,130,90,-7.2015,6.0284,-2.0221,6.7288,-4.1283,6.5503,-2.1197,6.6679,0.3791,0.1432,-5.1794,-2.0086,5.3714
261,2004247N10332,IVAN,9.7,329.7,1499,TS,35,0,17,265,9/3/04 06:00,2004,9,3,6,46.3,25.8646,60,102.5,102.5,60,180,80,90,-5.9376,7.4883,-2.9993,7.6556,-3.9875,7.8655,-1.7687,6.3376,0.4925,0.1861,-2.9383,-2.2188,3.6703
262,2004247N10332,IVAN,9.5,327.9,1626,TS,40,0,17,265,9/3/04 12:00,2004,9,3,12,46.3,26.8155,50,75,75,80,20,150,50,-6.1075,5.5642,-2.9867,7.3635,-3.9374,7.3136,-0.7697,6.9425,0.243,0.0917,-3.1208,-3.1677,4.1824
263,2004247N10332,IVAN,9.3,326.4,1530,TS,45,0,14,260,9/3/04 18:00,2004,9,3,18,171.31,30.9841,50,52.5,52.5,40,50,80,40,-5.9919,4.8144,-2.4523,7.2907,-3.7239,5.6346,0.0098,6.8608,0.2759,0.104,-3.5396,-3.7337,4.6025
264,2004247N10332,IVAN,9.1,325,1446,TS,45,0,14,260,9/4/04 00:00,2004,9,4,0,171.31,29.7746,100,97.5,97.5,100,100,140,50,-7.54,4.421,-2.5411,6.8801,-5.0072,6.5187,-0.2253,7.9515,0.6464,0.2439,-4.9989,-4.7819,6.5001
265,2004247N10332,IVAN,8.9,323.5,1372,TS,50,0,16,265,9/4/04 06:00,2004,9,4,6,148.16,29.4833,130,87.5,87.5,100,130,50,70,-5.5055,6.254,-3.3661,7.8694,-5.5703,7.4048,0.4952,9.1443,0.4492,0.1696,-2.1394,-6.0655,4.4296
266,2004247N10332,IVAN,8.9,321.8,1334,TS,50,0,17,270,9/4/04 12:00,2004,9,4,12,148.16,33.2185,130,125,125,130,130,150,90,-7.1513,6.561,-4.7417,7.0441,-5.9098,5.3937,2.5387,8.7188,0.4949,0.187,-2.4096,-8.4485,3.8987
267,2004247N10332,IVAN,9,320.1,1300,TS,55,0,16,280,9/4/04 18:00,2004,9,4,18,129.64,32.707,100,122.5,122.5,100,230,50,110,-8.0533,5.1356,-4.059,7.7944,-3.7213,4.8076,2.8314,8.4574,0.3836,0.1448,-3.9943,-6.5527,3.9225
268,2004247N10332,IVAN,9.3,318.6,1228,TS,60,0,18,280,9/5/04 00:00,2004,9,5,0,157.42,34.7089,40,50,50,40,40,50,70,-8.096,4.8953,-5.6279,7.8834,-3.9082,4.4099,3.0938,7.5521,0.5091,0.1919,-2.4681,-7.002,2.5677
269,2004247N10332,IVAN,9.5,316.6,1049,HU,65,1,19,275,9/5/04 06:00,2004,9,5,6,166.68,33.4919,60,80,80,60,70,80,110,-6.7341,5.2137,-6.3786,7.8452,-4.4363,5.9603,3.0555,7.5005,0.9664,0.3646,-0.3555,-7.4918,0.9914
270,2004247N10332,IVAN,9.8,314.9,921,HU,85,2,17,280,9/5/04 12:00,2004,9,5,12,175.94,38.6066,60,75,75,60,60,110,70,-7.3923,5.31,-6.1723,7.9467,-0.897,6.1143,2.697,8.6074,1.1078,0.4176,-1.22,-3.594,0.7107
271,2004247N10332,IVAN,10.2,313.2,826,HU,110,3,17,285,9/5/04 18:00,2004,9,5,18,185.2,35.8074,80,92.5,92.5,80,90,80,120,-7.4617,4.9682,-5.9205,8.035,1.267,5.3441,2.796,9.1904,1.0057,0.3791,-1.5412,-1.529,1.021
272,2004247N10332,IVAN,10.6,311.5,755,HU,115,4,18,280,9/6/04 00:00,2004,9,6,0,203.72,38.3921,60,77.5,77.5,60,80,100,70,-5.7069,6.6804,-9.2095,8.6427,3.0601,6.2664,1.9065,9.2134,0.9197,0.3464,3.5026,1.1536,-2.9292
273,2004247N10332,IVAN,10.8,309.5,666,HU,110,3,20,275,9/6/04 06:00,2004,9,6,6,203.72,37.7339,90,90,90,80,110,80,90,-5.8739,5.9359,-9.6161,8.3244,2.5338,6.6641,2.7749,8.9475,1.0304,0.3886,3.7422,-0.2411,-3.6114
274,2004247N10332,IVAN,11,307.5,601,HU,110,3,20,280,9/6/04 12:00,2004,9,6,12,212.98,41.0267,90,105,105,90,90,120,120,-5.1053,5.9797,-9.4063,8.4984,3.2476,8.6315,3.49,8.9479,1.2672,0.478,4.301,-0.2424,-3.9822
275,2004247N10332,IVAN,11.3,305.6,604,HU,90,2,18,275,9/6/04 18:00,2004,9,6,18,157.42,44.9005,80,82.5,82.5,80,90,90,70,-4.8041,7.3101,-8.9217,9.6163,3.7199,7.2655,3.1931,8.9895,1.3057,0.4919,4.1176,0.5268,-3.4
276,2004247N10332,IVAN,11.2,303.9,479,HU,90,2,17,270,9/7/04 00:00,2004,9,7,0,175.94,48.6149,90,95,95,90,60,120,110,-6.4723,5.1563,-8.9439,9.5077,4.7331,6.4995,3.5868,10.4592,1.4186,0.5347,2.4716,1.1463,-1.618
277,2004247N10332,IVAN,11.3,302.2,355,HU,95,2,16,280,9/7/04 06:00,2004,9,7,6,185.2,46.645,80,85,85,80,60,90,110,-3.3364,5.5016,-9.0642,10.0818,5.3236,6.6041,4.325,9.248,1.439,0.542,5.7278,0.9986,-3.7605
278,2004247N10332,IVAN,11.6,300.6,201,HU,100,3,17,280,9/7/04 12:00,2004,9,7,12,185.2,46.1994,100,65,65,100,60,40,60,-4.5162,6.9993,-9.3854,9.6425,6.9732,7.5646,2.1714,8.9354,1.5527,0.584,4.8692,4.8018,-1.3254
279,2004247N10332,IVAN,11.8,298.9,123,HU,105,3,14,275,9/7/04 18:00,2004,9,7,18,201.405,45.9473,80,75,75,80,90,60,70,-5.5778,5.8631,-9.8531,9.6559,6.8228,6.36,2.9078,9.9535,1.3406,0.5047,4.2753,3.915,-1.4606
280,2004247N10332,IVAN,12,297.4,145,HU,115,4,17,280,9/8/04 00:00,2004,9,8,0,210.665,45.2496,90,80,80,90,70,80,80,-3.3916,5.2707,-9.6171,9.7886,7.4132,6.1222,1.7853,9.3601,1.4869,0.5593,6.2255,5.6279,-1.6292
281,2004247N10332,IVAN,12.3,295.9,190,HU,120,4,14,280,9/8/04 06:00,2004,9,8,6,210.665,49.8431,40,60,60,40,90,60,50,-3.6518,5.1596,-10.5189,8.8617,8.3609,4.7168,2.1936,9.4359,1.5525,0.5836,6.8671,6.1673,-1.6216
282,2004247N10332,IVAN,12.6,294.5,230,HU,120,4,15,285,9/8/04 12:00,2004,9,8,12,210.665,49.2328,40,57.5,57.5,40,100,60,30,-5.1602,4.9898,-9.7742,10.2527,5.8923,7.2432,2.8807,10.0121,1.6654,0.6253,4.614,3.0116,-2.3574
283,2004247N10332,IVAN,13,293,252,HU,120,4,14,285,9/8/04 18:00,2004,9,8,18,210.665,43.763,130,87.5,87.5,130,70,60,90,-4.9278,4.5967,-8.4366,10.4142,3.9424,5.5755,3.4426,9.5377,1.2762,0.4807,3.5088,0.4998,-2.8012
284,2004247N10332,IVAN,13.3,291.7,218,HU,130,4,12,285,9/9/04 00:00,2004,9,9,0,222.24,47.3389,100,80,80,100,110,60,50,-3.9197,5.8428,-8.6701,11.661,5.4896,6.8914,2.7765,10.1037,1.7979,0.6758,4.7504,2.7131,-2.3585
285,2004247N10332,IVAN,13.7,290.5,184,HU,140,5,13,290,9/9/04 06:00,2004,9,9,6,222.24,50.8413,60,65,65,50,60,110,40,-3.7347,5.8311,-8.409,11.4418,5.0607,7.12,3.6543,11.3463,1.867,0.7019,4.6743,1.4064,-2.8791
286,2004247N10332,IVAN,14.2,289.2,215,HU,140,5,13,295,9/9/04 12:00,2004,9,9,12,222.24,55.583,70,57.5,57.5,70,70,50,40,-6.4048,6.4688,-7.7727,11.7523,3.7,8.4601,1.8536,11.111,2.7271,1.0236,1.3679,1.8464,-0.5939
287,2004247N10332,IVAN,14.7,288.1,258,HU,130,4,11,300,9/9/04 18:00,2004,9,9,18,196.775,52.5433,70,77.5,77.5,70,70,90,80,-6.8532,8.0092,-6.4975,11.8954,3.67,7.1326,2.0392,12.291,1.8631,0.7004,-0.3557,1.6308,0.964
288,2004247N10332,IVAN,15.2,287.2,307,HU,130,4,10,300,9/10/04 00:00,2004,9,10,0,222.24,51.6396,70,80,80,70,90,70,90,-5.7423,8.4317,-6.4727,12.3037,4.4982,7.9504,-0.2548,12.3267,2.3755,0.8929,0.7304,4.753,0.8167
289,2004247N10332,IVAN,15.7,286.2,257,HU,125,4,10,300,9/10/04 06:00,2004,9,10,6,222.24,54.4255,90,72.5,72.5,90,90,50,60,-4.5285,7.4332,-6.5487,11.8323,2.4476,7.0882,1.2158,12.0771,2.6208,0.9843,2.0202,1.2318,-1.513
290,2004247N10332,IVAN,16.2,285.3,218,HU,125,4,11,300,9/10/04 12:00,2004,9,10,12,222.24,58.744,90,67.5,67.5,90,50,40,90,-5.244,7.8023,-5.6497,12.8724,2.9555,8.7584,0.4321,11.8582,2.686,1.0084,0.4057,2.5234,0.3533
291,2004247N10332,IVAN,16.8,284.2,130,HU,120,4,10,305,9/10/04 18:00,2004,9,10,18,222.24,57.0892,70,72.5,72.5,90,80,50,70,-4.7864,7.8102,-4.1883,13.2859,2.3857,8.9643,1.7292,11.959,2.5879,0.9719,-0.5981,0.6565,0.8168
292,2004247N10332,IVAN,17.3,283.5,67,HU,135,4,10,290,9/11/04 00:00,2004,9,11,0,222.24,59.6436,60,47.5,47.5,60,50,50,30,-1.3327,8.3312,-5.7249,13.6729,1.1086,8.5826,1.0225,12.1484,2.8456,1.0644,4.3922,0.0861,-4.082
293,2004247N10332,IVAN,17.4,282.4,54,HU,130,4,9,280,9/11/04 06:00,2004,9,11,6,231.5,56.2777,90,60,60,90,80,40,30,-1.5974,7.8919,-4.9519,13.8676,-1.0207,8.8194,1.788,12.7119,2.5903,0.9704,3.3545,-2.8087,-3.3692
294,2004247N10332,IVAN,17.7,281.6,55,HU,125,4,7,300,9/11/04 12:00,2004,9,11,12,231.5,56.8432,90,70,70,60,90,70,60,-0.3874,7.4455,-4.3662,15.8285,-3.4636,7.8796,3.0985,13.0231,2.2707,0.8504,3.9788,-6.5621,-1.8687
295,2004247N10332,IVAN,18,281,67,HU,145,5,6,295,9/11/04 18:00,2004,9,11,18,231.5,59.7707,90,90,90,90,90,90,90,-1.4092,8.1444,-4.0541,16.001,-1.0402,9.16,2.2674,14.183,2.7061,1.0161,2.6449,-3.3076,-2.8936
296,2004247N10332,IVAN,18.2,280.4,126,HU,145,5,7,285,9/12/04 00:00,2004,9,12,0,231.5,66.1371,60,67.5,67.5,60,60,70,80,-1.4001,9.4057,-5.3771,15.498,-0.1025,9.9025,1.339,14.9197,2.9727,1.1134,3.977,-1.4415,-4.1375
297,2004247N10332,IVAN,18.4,279.6,212,HU,135,4,8,290,9/12/04 06:00,2004,9,12,6,231.5,67.2644,90,72.5,72.5,90,60,60,80,-0.9059,9.5475,-5.8544,16.0582,0.612,9.4844,2.8507,15.1993,3.1247,1.1705,4.9485,-2.2387,-5.4183
298,2004247N10332,IVAN,18.8,278.8,302,HU,135,4,8,295,9/12/04 12:00,2004,9,12,12,240.76,71.949,60,67.5,67.5,80,70,60,60,-0.2537,9.4232,-4.9605,16.6551,0.7124,11.7133,3.5878,16.4418,3.7643,1.409,4.7068,-2.8754,-5.3658
299,2004247N10332,IVAN,19.1,277.9,267,HU,130,4,9,295,9/12/04 18:00,2004,9,12,18,240.76,74.7887,90,80,80,90,60,80,90,-0.8363,11.4842,-3.3185,17.602,1.8083,11.1968,3.9622,16.5726,3.0901,1.1572,2.4822,-2.1539,-3.176
300,2004247N10332,IVAN,19.5,277.2,212,HU,140,5,8,300,9/13/04 00:00,2004,9,13,0,277.8,72.5782,110,72.5,72.5,110,40,30,110,2.1482,9.9024,-6.221,16.5516,1.1652,12.3739,1.8912,16.3682,2.956,1.1055,8.3692,-0.726,-4.0583
301,2004247N10332,IVAN,19.9,276.5,182,HU,140,5,8,305,9/13/04 06:00,2004,9,13,6,266.225,61.1745,90,80,80,90,70,70,90,1.6491,7.6081,-6.8338,15.9241,3.3969,10.1523,3.2875,16.1421,2.9428,1.101,8.4829,0.1094,-3.8074
302,2004247N10332,IVAN,20.4,275.9,161,HU,140,5,8,310,9/13/04 12:00,2004,9,13,12,268.54,60.9624,40,55,55,40,50,70,60,1.462,9.0159,-6.0806,16.0001,3.401,10.5848,3.1878,16.0292,3.0726,1.145,7.5426,0.2132,-3.1636
303,2004247N10332,IVAN,20.9,275.3,101,HU,140,5,7,330,9/13/04 18:00,2004,9,13,18,303.265,66.9636,60,67.5,67.5,70,60,70,70,2.528,8.4933,-6.3841,17.0997,3.4551,10.5483,3.3968,16.402,3.524,1.3159,8.9121,0.0583,-2.9503
304,2004247N10332,IVAN,21.6,274.9,35,HU,140,5,9,325,9/14/04 00:00,2004,9,14,0,289.375,68.4668,50,57.5,57.5,50,50,60,70,3.9975,8.2484,-8.0657,16.6157,4.7487,10.4916,3.811,17.0722,3.6309,1.3519,12.0632,0.9377,-2.7135
305,2004247N10332,IVAN,22.4,274.4,83,HU,140,5,9,335,9/14/04 06:00,2004,9,14,6,289.375,70.7762,60,65,65,60,50,90,60,2.8987,8.8772,-8.0754,17.747,6.2905,11.3259,4.0402,16.6653,3.5335,1.3175,10.9741,2.2503,-2.1034
306,2004247N10332,IVAN,23,274,160,HU,125,4,7,325,9/14/04 12:00,2004,9,14,12,347.25,63.5068,60,72.5,72.5,60,60,90,80,2.9694,8.8063,-7.1136,17.213,6.3568,9.0994,2.9543,18.4938,3.7582,1.4023,10.083,3.4025,-0.6865
307,2004247N10332,IVAN,23.7,273.5,251,HU,120,4,10,330,9/14/04 18:00,2004,9,14,18,347.25,63.5371,80,75,75,80,80,60,80,1.3346,11.1767,-6.6812,16.8084,8.275,10.4582,3.2934,18.5487,3.3756,1.2594,8.0158,4.9816,0.9331
308,2004247N10332,IVAN,24.7,273,357,HU,120,4,10,335,9/15/04 00:00,2004,9,15,0,347.25,63.259,100,87.5,87.5,100,100,80,70,2.7048,11.4154,-7.4698,17.1915,6.3916,9.8558,2.6386,18.455,3.1964,1.1942,10.1746,3.753,-0.9818
309,2004247N10332,IVAN,25.6,272.6,415,HU,120,4,11,335,9/15/04 06:00,2004,9,15,6,347.25,66.608,60,75,75,60,80,100,60,-0.994,11.6265,-7.8003,18.0318,6.8059,10.3387,6.2732,17.8528,3.2474,1.2095,6.8063,0.5327,-3.1318
310,2004247N10332,IVAN,26.7,272.1,282,HU,115,4,12,340,9/15/04 12:00,2004,9,15,12,370.4,68.4958,80,85,85,80,80,100,80,-1.904,11.1718,-5.3643,18.7233,7.367,12.1046,7.174,18.7217,3.8331,1.4302,3.4603,0.193,-1.3487
311,2004247N10332,IVAN,27.9,271.8,151,HU,115,4,11,355,9/15/04 18:00,2004,9,15,18,347.25,68.7931,60,70,70,60,90,70,60,-1.8691,10.7953,-4.9223,18.9616,8.9864,11.1249,6.6727,19.7152,4.0715,1.5141,3.0532,2.3137,0.8869
312,2004247N10332,IVAN,28.9,271.8,80,HU,110,3,10,10,9/16/04 00:00,2004,9,16,0,347.25,64.3464,80,72.5,72.5,60,80,70,80,1.9639,9.0435,-5.7373,18.3405,7.7171,9.87,4.2695,18.6942,3.6335,1.3524,7.7012,3.4476,0.8115
313,2004247N10332,IVAN,30,272.1,24,HU,105,3,13,10,9/16/04 06:00,2004,9,16,6,324.1,72.8259,40,72.5,72.5,40,60,110,80,4.7444,8.4478,-6.2077,17.7159,7.6779,9.9194,7.1106,19.1037,4.1426,1.542,10.9521,0.5673,-0.4136
314,2004247N10332,IVAN,31.4,272.3,0,HU,70,1,13,10,9/16/04 12:00,2004,9,16,12,254.65,55.6801,140,95,95,60,140,120,60,5.7422,7.7777,-3.9678,17.4567,8.9811,7.9344,5.7603,18.5022,2.4017,0.8986,9.71,3.2208,3.6653
315,2004247N10332,IVAN,32.5,272.6,0,TS,50,0,13,25,9/16/04 18:00,2004,9,16,18,92.6,36.3374,300,212.5,212.5,130,300,270,150,7.1315,6.6491,-3.0157,15.6023,11.2611,6.9058,3.2369,18.4195,2.134,0.8033,10.1472,8.0242,8.9053
316,2004247N10332,IVAN,33.8,273.5,0,TD,30,-1,13,30,9/17/04 00:00,2004,9,17,0,,27.5842,500,335,335,290,500,420,130,8.5846,5.5169,-2.0217,14.7823,11.4007,7.1604,1.4569,17.0031,1.603,0.6053,10.6063,9.9438,11.7794
317,2004247N10332,IVAN,34.7,274.3,0,TD,25,-1,13,55,9/17/04 06:00,2004,9,17,6,,19.3156,170,282.5,282.5,340,170,500,120,10.1976,4.712,-0.9245,12.2161,12.7849,5.9753,1.481,16.978,1.3574,0.513,11.1221,11.3039,14.6079
318,2004247N10332,IVAN,35.4,276,0,TD,20,-1,16,65,9/17/04 12:00,2004,9,17,12,,24.4247,490,280,280,300,490,180,150,11.9739,5.2552,2.6224,10.7019,12.1714,6.0129,1.7373,16.6197,1.209,0.4577,9.3515,10.4341,13.9282
319,2004247N10332,IVAN,36.2,277.7,0,TD,20,-1,16,60,9/17/04 18:00,2004,9,17,18,,26.884,460,402.5,402.5,340,460,320,490,12.7767,3.4536,2.6343,8.7472,12.8801,5.2218,2.0451,16.0619,1.1874,0.4505,10.1424,10.835,14.8073
320,2004247N10332,IVAN,37,279.5,0,TD,20,-1,17,65,9/18/04 00:00,2004,9,18,0,,27.6949,440,272.5,272.5,410,440,140,100,12.8226,3.4834,3.3906,9.5945,12.9374,4.9173,-2.4428,16.7419,0.7207,0.2733,9.432,15.3802,14.0363
321,2004247N10332,IVAN,37.7,281.5,0,TD,15,-1,17,65,9/18/04 06:00,2004,9,18,6,,28.8256,480,367.5,367.5,310,480,490,190,12.0311,3.4969,0.8581,8.7708,12.4698,6.0869,-1.8646,17.4861,1.3031,0.4959,11.173,14.3344,15.275
322,2004247N10332,IVAN,38.4,283.3,0,TD,15,-1,12,80,9/18/04 12:00,2004,9,18,12,,28.0904,440,375,375,490,440,450,120,12.4512,4.8673,0.0447,8.8251,13.0946,5.1478,-2.8517,16.6105,1.4921,0.5688,12.4065,15.9463,15.2173
323,2004247N10332,IVAN,38,284.5,0,EX,25,-4,12,110,9/18/04 18:00,2004,9,18,18,,32.6482,480,272.5,272.5,480,430,100,80,14.4202,4.4964,1.6844,8.0308,11.0877,5.5937,-1.2356,14.3852,1.2956,0.4932,12.7358,12.3233,16.1011
324,2004247N10332,IVAN,37.5,286,130,EX,35,-4,12,150,9/19/04 00:00,2004,9,19,0,27.78,32.7737,180,202.5,202.5,170,340,180,120,15.8961,3.3255,1.4846,7.5873,12.7596,5.6521,-3.0705,12.618,0.5911,0.2247,14.4115,15.8301,16.9731
325,2004247N10332,IVAN,36,286,136,EX,35,-4,16,190,9/19/04 06:00,2004,9,19,6,34.725,31.2969,220,290,290,280,460,200,220,16.9012,5.0776,0.5839,8.3332,9.8773,8.1584,-3.5196,9.8137,0.7961,0.303,16.3173,13.3969,16.0081
326,2004247N10332,IVAN,34.5,285.5,164,EX,35,-4,18,205,9/19/04 12:00,2004,9,19,12,34.725,33.2214,180,107.5,107.5,180,40,120,90,14.3079,7.0338,-0.4381,6.7135,9.571,8.9483,-5.6002,7.8918,0.0182,0.0069,14.746,15.1712,11.5966
327,2004247N10332,IVAN,32.8,284.2,221,EX,35,-4,22,220,9/19/04 18:00,2004,9,19,18,34.725,31.6746,180,97.5,97.5,180,10,40,160,10.7664,5.9147,-3.4464,5.9838,10.73,5.6418,-6.7036,5.8453,-0.1572,-0.0596,14.2128,17.4336,7.6626
328,2004247N10332,IVAN,31,282.5,285,EX,35,-4,23,210,9/20/04 00:00,2004,9,20,0,34.725,32.8068,260,107.5,107.5,260,40,40,90,8.7564,6.6359,-7.0024,5.089,10.6009,7.6002,-6.2426,3.872,-0.1132,-0.0429,15.7588,16.8435,4.3687
329,2004247N10332,IVAN,29,281.5,202,EX,35,-4,19,195,9/20/04 06:00,2004,9,20,6,27.78,34.333,190,102.5,102.5,190,40,60,120,5.8181,5.256,-6.9775,4.883,11.9895,4.7231,-4.9605,3.4818,-0.0853,-0.0323,12.7956,16.95,4.7655
330,2004247N10332,IVAN,27.5,281.3,149,EX,30,-4,13,190,9/20/04 12:00,2004,9,20,12,,30.3267,470,385,385,470,500,130,440,4.6059,4.0993,-4.0411,6.3369,9.0514,3.3731,-4.5054,2.9799,0.1189,0.0451,8.647,13.5568,4.1037
331,2004247N10332,IVAN,26.4,280.9,99,EX,25,-4,8,215,9/20/04 18:00,2004,9,20,18,,30.5225,490,432.5,432.5,490,470,300,470,3.0586,4.2076,-3.1767,6.054,9.4733,2.9288,-4.5613,2.4966,0.1987,0.0752,6.2353,14.0346,4.3963
332,2004247N10332,IVAN,26.1,280.3,39,EX,25,-4,7,255,9/21/04 00:00,2004,9,21,0,,27.2267,480,342.5,342.5,450,20,420,480,5.7605,2.8416,-4.0799,6.1716,10.5352,2.6089,-4.3439,2.6291,0.1544,0.0584,9.8404,14.8791,6.0478
333,2004247N10332,IVAN,25.9,279.4,0,EX,25,-4,9,265,9/21/04 06:00,2004,9,21,6,,27.8393,390,385,385,390,180,480,490,10.786,3.3792,-6.3285,6.0298,10.6485,2.6503,-2.1025,2.3816,0.0773,0.0292,17.1145,12.751,8.4882
334,2004247N10332,IVAN,25.8,278.3,11,EX,25,-4,11,250,9/21/04 12:00,2004,9,21,12,,24.6887,180,202.5,202.5,330,20,280,180,12.3273,6.0225,-5.447,5.1038,7.5729,3.5673,-0.9977,2.5533,0.0866,0.0328,17.7743,8.5706,8.93
335,2004247N10332,IVAN,25.2,277.2,135,LO,25,-3,12,240,9/21/04 18:00,2004,9,21,18,,24.0826,480,442.5,442.5,490,430,370,480,11.9032,5.1867,-4.5858,4.8993,7.2912,2.365,-0.722,2.9286,0.0776,0.0294,16.489,8.0132,9.3165
336,2004247N10332,IVAN,24.8,275.9,223,LO,25,-3,16,265,9/22/04 00:00,2004,9,22,0,,25.4879,440,410,410,460,480,260,440,14.1108,4.8806,-6.0245,5.09,9.8834,4.4928,-1.8251,3.4225,0.2275,0.0861,20.1353,11.7085,10.9329
337,2004247N10332,IVAN,25.1,273.9,342,LO,25,-3,16,295,9/22/04 06:00,2004,9,22,6,,26.1294,460,325,325,460,180,210,450,13.6631,5.8541,-7.5483,4.5102,10.3193,4.1152,1.1784,3.5624,0.4825,0.1828,21.2114,9.1409,9.4824
338,2004247N10332,IVAN,26,272.7,379,LO,25,-3,13,305,9/22/04 12:00,2004,9,22,12,,26.8027,90,242.5,242.5,90,410,220,250,11.8708,6.4159,-5.5097,5.0346,10.317,5.5005,2.3581,4.0101,0.4683,0.1776,17.3805,7.9589,9.7345
339,2004247N10332,IVAN,26.5,271.4,283,TD,30,-1,11,300,9/22/04 18:00,2004,9,22,18,,25.3838,280,240,240,280,260,290,130,5.8197,6.6368,-4.8534,5.4555,10.5692,5.5078,2.2425,4.4766,0.5102,0.1935,10.6731,8.3267,6.7191
340,2004247N10332,IVAN,27.1,270.5,215,TS,35,0,13,305,9/23/04 00:00,2004,9,23,0,48.615,25.9825,160,160,160,160,190,140,150,3.3109,4.7541,-6.0677,5.3868,11.3358,6.8426,0.5184,4.3644,0.7162,0.2714,9.3786,10.8174,5.7196
341,2004247N10332,IVAN,27.9,269,134,TS,35,0,16,305,9/23/04 06:00,2004,9,23,6,57.875,27.8774,120,125,125,120,90,170,120,3.1008,3.6701,-7.5193,5.0691,9.9404,10.1566,3.5376,4.295,0.6252,0.2368,10.6201,6.4028,2.1029
342,2004247N10332,IVAN,28.9,267.8,67,TS,50,0,10,310,9/23/04 12:00,2004,9,23,12,83.34,24.632,90,112.5,112.5,90,140,120,100,4.6258,4.8769,-3.4542,4.2567,8.8398,11.2337,4.336,3.9298,0.4005,0.1518,8.08,4.5038,4.4333
343,2004247N10332,IVAN,29.2,267.3,45,TS,40,0,4,310,9/23/04 18:00,2004,9,23,18,74.08,21.0772,90,120,120,90,190,100,100,3.5494,4.3347,-2.578,4.0222,8.9541,8.9968,1.575,4.6551,0.3669,0.139,6.1274,7.3791,6.6109
344,2004247N10332,IVAN,29.6,266.8,22,TD,30,-1,9,305,9/24/04 00:00,2004,9,24,0,,18.8819,140,147.5,147.5,350,140,50,50,5.2715,4.3376,-3.9272,3.6206,10.059,8.4736,0.0375,4.5961,0.4622,0.1751,9.1987,10.0215,7.4292
345,2004247N10332,IVAN,30.1,265.8,0,TD,25,-1,8,300,9/24/04 06:00,2004,9,24,6,,19.5083,300,150,150,160,300,100,40,7.2152,4.2607,-4.2881,2.8683,10.6899,7.9246,1.1994,4.7721,0.3813,0.1446,11.5033,9.4905,8.4443
346,2004252N32320,UNNAMED,31.5,320.3,2037,TD,25,-1,4,60,9/7/04 12:00,2004,9,7,12,,22.8853,500,287.5,287.5,90,200,360,500,10.768,3.1309,-1.3776,4.3631,9.0911,3.1401,3.4744,6.0902,0.703,0.2687,12.1456,5.6167,10.3549
347,2004252N32320,UNNAMED,31.7,320.7,2037,TD,25,-1,5,60,9/7/04 18:00,2004,9,7,18,,23.09,170,257.5,257.5,170,150,210,500,13.5893,3.6462,-0.8534,4.9926,12.9282,3.7515,3.0785,6.2338,0.8369,0.3194,14.4427,9.8497,15.5619
348,2004252N32320,UNNAMED,32,321.3,2039,TD,25,-1,6,60,9/8/04 00:00,2004,9,8,0,,24.3986,200,200,200,220,140,240,200,15.3043,2.7454,-1.4656,4.4087,10.6426,5.0261,3.075,6.3716,0.9756,0.3726,16.7699,7.5676,15.2346
349,2004252N32320,UNNAMED,32.3,321.9,2043,TD,25,-1,8,60,9/8/04 06:00,2004,9,8,6,,24.6921,290,202.5,202.5,290,170,80,270,11.04,3.7684,1.1081,5.0972,12.1519,5.8542,4.4388,6.9569,0.8544,0.3266,9.9319,7.7131,11.843
350,2004252N32320,UNNAMED,32.8,322.9,2001,TD,25,-1,12,50,9/8/04 12:00,2004,9,8,12,,21.2727,120,230,230,120,140,170,490,10.29,3.1046,2.4332,5.2357,13.6622,6.2688,2.7204,5.9998,1.0258,0.3925,7.8568,10.9418,13.454
351,2004252N32320,UNNAMED,33.8,324,1922,TD,25,-1,16,35,9/8/04 18:00,2004,9,8,18,,26.324,490,287.5,287.5,360,130,170,490,12.5992,3.483,1.6637,5.083,13.2863,5.4875,3.0157,5.5342,1.2363,0.4732,10.9355,10.2706,14.8661
352,2004252N32320,UNNAMED,35.3,325,1882,TD,30,-1,15,30,9/9/04 00:00,2004,9,9,0,,26.6425,380,315,315,430,160,290,380,13.2774,4.3189,-0.479,5.7807,8.4716,4.9467,1.9657,6.4152,1.2231,0.4691,13.7564,6.5059,13.7266
353,2004252N32320,UNNAMED,36.2,325.7,1860,TD,30,-1,8,45,9/9/04 06:00,2004,9,9,6,,24.8814,420,362.5,362.5,230,380,420,420,10.2943,5.1815,0.1966,5.7229,9.7076,5.7966,1.7036,5.5874,1.0312,0.396,10.0977,8.004,12.4347
354,2004252N32320,UNNAMED,36.5,326.4,1816,LO,30,-3,3,120,9/9/04 12:00,2004,9,9,12,,24.7629,390,415,415,470,320,480,390,10.8503,6.7691,1.0924,6.0764,4.7757,6.5501,0.5082,5.5909,0.7242,0.278,9.7579,4.2675,10.65
355,2004252N32320,UNNAMED,36,326.6,1777,LO,30,-3,7,135,9/9/04 18:00,2004,9,9,18,,21.0011,370,352.5,352.5,370,270,280,490,8.1898,5.7831,2.0163,5.3698,3.5751,6.4804,-0.2422,4.7333,0.8566,0.3281,6.1735,3.8173,6.9053
356,2004252N32320,UNNAMED,35.7,327.7,1673,LO,30,-3,10,105,9/10/04 00:00,2004,9,10,0,,21.774,370,335,335,370,270,330,370,8.3706,5.7397,2.9319,5.1321,-2.4755,7.0245,-0.0623,5.3086,0.7436,0.2847,5.4387,-2.4132,5.7964
357,2004252N32320,UNNAMED,35.5,329,1558,LO,25,-3,12,100,9/10/04 06:00,2004,9,10,6,,22.6265,390,367.5,367.5,340,370,370,390,6.0396,5.5104,3.8549,4.2239,-5.121,7.3435,-1.0082,4.8427,0.8235,0.3157,2.1847,-4.1128,3.9339
358,2004252N32320,UNNAMED,35.3,330.5,1428,LO,20,-3,13,100,9/10/04 12:00,2004,9,10,12,,23.0449,380,345,345,330,300,370,380,6.5202,5.2177,1.9051,4.7624,-4.926,8.0225,-0.6648,4.988,0.8973,0.3441,4.6151,-4.2612,6.154
359,2004258N16300,JEANNE,15.9,300,592,TD,25,-1,6,275,9/13/04 18:00,2004,9,13,18,,22.7652,200,262.5,262.5,200,160,490,200,-5.5224,5.6779,-4.0944,6.3086,-1.2645,5.155,3.1042,3.3453,0.1108,0.0419,-1.428,-4.3687,0.5272
360,2004258N16300,JEANNE,16,299.3,576,TD,25,-1,8,285,9/14/04 00:00,2004,9,14,0,,22.36,190,265,265,190,130,490,250,-3.6774,5.634,-5.3275,5.9872,1.1561,5.4951,2.1622,3.4211,0.1324,0.05,1.6501,-1.0061,-1.8947
361,2004258N16300,JEANNE,16.3,298.5,484,TD,30,-1,8,285,9/14/04 06:00,2004,9,14,6,,24.1158,110,217.5,217.5,110,110,490,160,-0.0161,6.4297,-5.4042,5.2231,1.6121,5.7299,3.6764,3.2885,0.1018,0.0384,5.3881,-2.0643,-4.924
362,2004258N16300,JEANNE,16.4,297.4,376,TS,35,0,11,280,9/14/04 12:00,2004,9,14,12,34.725,22.85,170,125,125,170,70,60,200,2.4352,5.4122,-4.5483,4.8019,1.218,5.8498,3.5654,3.4929,0.116,0.0438,6.9835,-2.3474,-3.0564
363,2004258N16300,JEANNE,16.7,296.5,278,TS,50,0,7,300,9/14/04 18:00,2004,9,14,18,64.82,31.1367,100,87.5,87.5,100,60,20,170,1.5858,4.1351,-4.3299,5.8651,2.4178,6.1112,4.3611,4.0921,0.2357,0.089,5.9157,-1.9433,-3.254
364,2004258N16300,JEANNE,17.1,296,209,TS,55,0,7,290,9/15/04 00:00,2004,9,15,0,64.82,27.6626,110,57.5,57.5,90,20,10,110,1.9482,3.813,-6.0168,5.8915,3.5819,5.886,2.0977,3.7009,0.0713,0.0269,7.965,1.4842,-2.2946
365,2004258N16300,JEANNE,17.2,295.2,138,TS,55,0,7,290,9/15/04 06:00,2004,9,15,6,64.82,23.6304,90,87.5,87.5,90,110,30,120,1.6637,5.0451,-6.0277,5.6397,1.9867,5.5142,3.5646,4.5301,0.1835,0.0693,7.6914,-1.5779,-4.4115
366,2004258N16300,JEANNE,17.6,294.6,61,TS,60,0,9,305,9/15/04 12:00,2004,9,15,12,92.6,26.7182,90,100,100,90,110,110,90,0.5797,5.7202,-6.1254,5.7189,3.912,5.7937,2.3619,5.6802,0.5601,0.2116,6.7051,1.5501,-2.6103
367,2004258N16300,JEANNE,18.1,293.8,0,TS,60,0,8,295,9/15/04 18:00,2004,9,15,18,111.12,32.4621,100,110,110,100,120,130,90,-0.769,5.753,-6.3328,6.6315,3.9291,4.5156,3.3,6.5706,0.5398,0.2039,5.5638,0.6291,-3.1374
368,2004258N16300,JEANNE,18.5,292.9,11,TS,60,0,8,290,9/16/04 00:00,2004,9,16,0,97.23,37.9853,120,112.5,112.5,120,190,90,50,-0.7063,5.4878,-7.1006,7.1811,4.6669,4.4607,2.3821,7.0053,0.5817,0.2197,6.3943,2.2848,-2.7695
369,2004258N16300,JEANNE,18.6,292.2,52,TS,60,0,5,275,9/16/04 06:00,2004,9,16,6,50.93,33.1418,120,85,85,120,70,60,90,0.0994,6.2524,-5.6442,6.9524,3.7798,4.3185,2.8546,6.7994,0.6772,0.2557,5.7436,0.9252,-2.5439
370,2004258N16300,JEANNE,18.6,291.5,0,HU,70,1,8,275,9/16/04 12:00,2004,9,16,12,50.93,35.4235,80,97.5,97.5,80,100,110,100,-0.7667,6.1764,-6.4143,6.7567,2.9915,4.4049,1.8028,7.0643,0.8078,0.3049,5.6476,1.1887,-3.5746
371,2004258N16300,JEANNE,18.8,291,0,HU,65,1,5,315,9/16/04 18:00,2004,9,16,18,97.23,36.5675,80,90,90,80,100,70,110,-0.873,6.838,-5.7155,8.2111,5.1514,4.7289,3.4696,6.1284,0.5978,0.2256,4.8425,1.6818,-1.4613
372,2004258N16300,JEANNE,19.2,290.6,0,TS,60,0,5,310,9/17/04 00:00,2004,9,17,0,97.23,35.9557,70,92.5,92.5,70,120,100,80,2.0178,6.2855,-5.4983,7.2011,4.0247,5.9882,2.8397,6.7125,0.5352,0.2018,7.5161,1.185,-1.6861
373,2004258N16300,JEANNE,19.4,290.1,0,TS,55,0,7,290,9/17/04 06:00,2004,9,17,6,97.23,36.4303,90,102.5,102.5,90,90,150,80,3.5011,6.2833,-6.3447,6.6347,2.1809,6.4992,3.7039,7.0984,0.7066,0.2666,9.8458,-1.523,-3.2219
374,2004258N16300,JEANNE,19.7,289.3,0,TS,50,0,9,290,9/17/04 12:00,2004,9,17,12,185.2,35.9993,60,167.5,167.5,60,180,370,60,5.5086,6.3034,-6.956,7.077,2.8276,5.4711,4.7341,6.8269,0.6048,0.2283,12.4646,-1.9065,-2.2222
375,2004258N16300,JEANNE,20,288.4,22,TD,30,-1,7,290,9/17/04 18:00,2004,9,17,18,,32.3711,90,145,145,90,190,220,80,3.7718,6.8193,-5.4109,6.1454,2.8213,5.9914,5.0523,6.4546,0.7777,0.2933,9.1827,-2.231,-2.6927
376,2004258N16300,JEANNE,20.2,288,49,TS,40,0,4,290,9/18/04 00:00,2004,9,18,0,13.89,32.9772,80,90,90,80,160,50,70,6.7308,7.0001,-5.4266,6.0615,-0.0407,5.941,3.6867,6.5194,0.5642,0.2127,12.1574,-3.7274,0.1705
377,2004258N16300,JEANNE,20.4,287.5,56,TS,45,0,7,320,9/18/04 06:00,2004,9,18,6,43.985,31.8056,60,60,60,60,70,40,70,4.8561,7.9377,-4.9683,5.636,-0.0886,7.5971,3.9881,6.4343,0.4913,0.1851,9.8244,-4.0767,-1.514
378,2004258N16300,JEANNE,21.2,287.2,20,TS,45,0,7,10,9/18/04 12:00,2004,9,18,12,67.135,31.0926,80,70,70,50,80,110,40,1.7883,10.2869,-4.7836,5.7049,-1.8562,8.7654,3.5435,6.8003,0.491,0.1852,6.5719,-5.3997,-3.3756
379,2004258N16300,JEANNE,21.7,287.7,91,TS,40,0,6,35,9/18/04 18:00,2004,9,18,18,69.45,32.4558,20,25,25,30,20,30,20,0.2417,8.7574,-4.0496,5.5528,1.8935,6.6284,5.1462,6.7047,-0.0038,-0.0014,4.2913,-3.2527,-4.6396
380,2004258N16300,JEANNE,22.2,287.8,139,TS,40,0,5,0,9/19/04 00:00,2004,9,19,0,69.45,36.0331,90,55,55,20,90,100,10,0.8459,6.2318,-3.9026,6.4092,3.7863,5.7554,5.379,7.5183,0.5681,0.2141,4.7485,-1.5927,-2.766
381,2004258N16300,JEANNE,22.8,287.7,192,TS,40,0,7,345,9/19/04 06:00,2004,9,19,6,69.45,32.9063,50,60,60,40,50,120,30,1.9213,6.0016,-2.209,5.9429,6.3542,4.6141,4.5022,7.5259,0.7071,0.2666,4.1303,1.852,1.6234
382,2004258N16300,JEANNE,23.5,287.5,262,TS,40,0,7,360,9/19/04 12:00,2004,9,19,12,69.45,31.9778,140,102.5,102.5,110,140,120,40,1.047,6.0187,-1.7261,6.1273,5.8854,5.5859,2.6547,8.326,0.6203,0.2342,2.7731,3.2307,2.8113
383,2004258N16300,JEANNE,24.2,287.7,342,TS,45,0,7,20,9/19/04 18:00,2004,9,19,18,138.9,32.9752,100,90,90,100,110,80,70,-0.7573,6.3879,-0.5732,6.4903,9.6872,5.3054,3.0979,9.1674,0.8002,0.3018,-0.1841,6.5893,6.5663
384,2004258N16300,JEANNE,24.8,287.9,412,TS,50,0,6,10,9/20/04 00:00,2004,9,20,0,138.9,32.6951,90,95,95,110,90,60,120,0.1833,5.0729,0.4093,6.6602,9.3254,5.4826,2.6636,9.9443,0.9235,0.3481,-0.226,6.6618,6.6323
385,2004258N16300,JEANNE,25.5,288,491,TS,55,0,10,10,9/20/04 06:00,2004,9,20,6,145.845,35.3923,110,102.5,102.5,110,110,90,100,4.3085,5.4724,-0.1084,7.8807,8.8452,4.3347,2.7525,9.1387,1.1966,0.4511,4.4169,6.0927,7.0841
386,2004258N16300,JEANNE,26.6,288.3,617,TS,60,0,10,15,9/20/04 12:00,2004,9,20,12,152.79,40.0581,90,85,85,90,90,90,70,4.24,6.0018,-1.8639,9.1571,7.286,5.4986,1.7103,9.0518,1.5793,0.595,6.1039,5.5757,5.9002
387,2004258N16300,JEANNE,27.2,288.6,689,HU,75,1,5,50,9/20/04 18:00,2004,9,20,18,157.42,42.3564,90,95,95,80,90,130,80,3.0435,8.177,-1.5186,10.7218,9.5003,7.3675,0.5993,10.7141,1.644,0.6197,4.5621,8.901,8.3433
388,2004258N16300,JEANNE,27.4,289.2,727,HU,75,1,6,70,9/21/04 00:00,2004,9,21,0,166.68,43.6375,70,75,75,90,80,60,70,5.7765,6.1644,-1.2721,11.099,7.0228,7.18,-0.9032,11.0831,1.9566,0.7356,7.0486,7.926,7.5331
389,2004258N16300,JEANNE,27.6,289.8,769,HU,75,1,6,80,9/21/04 06:00,2004,9,21,6,173.625,47.8782,40,67.5,67.5,40,70,120,40,7.868,5.7594,-3.0081,12.457,6.1988,7.0933,-1.4339,11.1743,2.1994,0.8263,10.8761,7.6327,6.6841
390,2004258N16300,JEANNE,27.6,290.5,797,HU,75,1,5,105,9/21/04 12:00,2004,9,21,12,173.625,51.5169,90,72.5,72.5,40,70,90,90,8.8637,6.5884,-3.8748,11.8498,4.319,7.1391,-1.8958,11.0963,1.6158,0.6078,12.7385,6.2148,5.5463
391,2004258N16300,JEANNE,27.4,290.8,792,HU,75,1,3,130,9/21/04 18:00,2004,9,21,18,173.625,45.6141,60,80,80,60,100,100,60,7.9437,5.2278,-2.5612,12.1097,3.4624,4.4767,-1.4664,11.4106,1.9698,0.7411,10.5049,4.9288,5.7142
392,2004258N16300,JEANNE,27.2,291.1,788,HU,80,1,4,145,9/22/04 00:00,2004,9,22,0,171.31,46.5015,80,82.5,82.5,80,90,80,80,8.4362,4.9576,-3.04,11.9494,2.3151,5.649,-3.3123,11.5919,2.1293,0.8012,11.4762,5.6274,4.2522
393,2004258N16300,JEANNE,26.8,291.3,762,HU,85,2,4,150,9/22/04 06:00,2004,9,22,6,189.83,47.0828,60,72.5,72.5,80,70,80,60,6.678,4.0548,-2.4168,12.3347,1.6629,5.1164,-2.7708,12.6939,2.3647,0.8884,9.0948,4.4337,3.2052
394,2004258N16300,JEANNE,26.5,291.5,748,HU,85,2,3,190,9/22/04 12:00,2004,9,22,12,194.46,49.5936,110,92.5,92.5,90,60,110,110,5.7401,5.0215,-3.3055,12.2589,1.7279,5.1817,-3.1254,12.9456,2.1698,0.8167,9.0456,4.8533,1.4454
395,2004258N16300,JEANNE,26.2,291.2,703,HU,85,2,5,210,9/22/04 18:00,2004,9,22,18,194.46,48.1114,90,87.5,87.5,90,100,70,90,1.5241,5.5397,-2.2846,12.5205,2.6277,4.2722,-2.431,13.2756,2.0302,0.7634,3.8087,5.0587,-0.2983
396,2004258N16300,JEANNE,25.7,291,647,HU,85,2,4,210,9/23/04 00:00,2004,9,23,0,194.46,46.8712,90,90,90,90,100,80,90,-0.8254,5.711,-1.8968,13.57,3.4213,4.3366,-3.0475,12.9011,2.0197,0.7592,1.0714,6.4688,-0.0701
397,2004258N16300,JEANNE,25.5,290.7,611,HU,85,2,3,250,9/23/04 06:00,2004,9,23,6,194.46,43.5856,80,85,85,80,90,80,90,-1.2162,5.2613,-1.6759,13.3644,2.7529,4.0697,-0.8763,12.9297,1.9794,0.7435,0.4597,3.6292,1.1184
398,2004258N16300,JEANNE,25.5,290.4,592,HU,80,1,4,300,9/23/04 12:00,2004,9,23,12,194.46,45.7471,60,75,75,60,60,90,90,-2.0532,5.4663,-2.3563,12.9072,-0.9375,4.6457,0.5134,12.9501,1.9936,0.7477,0.3031,-1.4509,-0.1545
399,2004258N16300,JEANNE,25.8,290,598,HU,75,1,4,310,9/23/04 18:00,2004,9,23,18,194.46,47.2107,100,95,95,100,100,90,90,-3.4767,7.3285,-1.3262,13.0933,-0.5333,5.3148,2.4002,13.76,1.9519,0.7325,-2.1505,-2.9335,0.7751
400,2004258N16300,JEANNE,26,289.6,598,HU,70,1,5,285,9/24/04 00:00,2004,9,24,0,194.46,46.4842,80,90,90,110,90,80,80,-4.1857,7.0071,-1.3647,13.6941,1.7879,4.7728,1.1988,13.5241,2.1043,0.7898,-2.821,0.5891,2.7351
401,2004258N16300,JEANNE,26.1,288.8,577,HU,75,1,8,275,9/24/04 06:00,2004,9,24,6,201.405,45.1911,90,80,80,90,70,70,90,-3.145,5.9373,-2.6877,13.4088,3.4224,4.9372,0.3212,13.6773,2.1669,0.8121,-0.4573,3.1012,1.9412
402,2004258N16300,JEANNE,26.2,287.8,564,HU,80,1,9,280,9/24/04 12:00,2004,9,24,12,212.98,46.9752,100,110,110,100,120,100,120,-3.6105,6.4793,-4.5477,13.2848,1.5038,5.8738,0.2283,13.3955,2.3886,0.8969,0.9372,1.2755,-0.6423
403,2004258N16300,JEANNE,26.4,286.9,507,HU,85,2,9,275,9/24/04 18:00,2004,9,24,18,212.98,47.8793,80,85,85,80,80,90,90,-3.3449,7.6917,-4.2925,13.9461,3.0013,6.3462,1.8236,14.0476,2.3737,0.8892,0.9476,1.1777,-0.1698
404,2004258N16300,JEANNE,26.4,285.7,397,HU,85,2,11,270,9/25/04 00:00,2004,9,25,0,247.705,50.8914,100,95,95,100,100,60,120,-4.761,7.2166,-2.7334,14.2938,2.0044,6.1083,0.722,14.1209,2.5095,0.941,-2.0276,1.2824,2.3386
405,2004258N16300,JEANNE,26.5,284.4,286,HU,90,2,12,275,9/25/04 06:00,2004,9,25,6,247.705,53.3463,80,87.5,87.5,80,100,90,80,-3.9654,6.3622,-3.7995,14.1182,1.6691,6.5951,-0.4219,14.3197,2.842,1.0646,-0.1659,2.091,0.4795
406,2004258N16300,JEANNE,26.6,283.1,200,HU,100,3,11,280,9/25/04 12:00,2004,9,25,12,233.815,50.607,110,87.5,87.5,110,70,80,90,-3.8648,6.944,-5.1124,14.5117,3.2148,6.372,0.5992,14.1434,2.7166,1.0177,1.2476,2.6156,-0.1203
407,2004258N16300,JEANNE,26.9,281.8,178,HU,105,3,12,285,9/25/04 18:00,2004,9,25,18,247.705,56.518,90,90,90,90,90,90,90,-3.4383,7.2402,-5.0061,14.342,3.284,7.5503,2.9201,14.7442,2.74,1.0266,1.5678,0.3639,-1.0409
408,2004258N16300,JEANNE,27.1,280.6,68,HU,105,3,11,280,9/26/04 00:00,2004,9,26,0,280.115,57.6613,50,82.5,82.5,100,90,90,50,-2.239,7.4489,-3.763,14.4798,3.1969,7.9399,0.9741,16.6071,3.0595,1.1444,1.524,2.2228,0.0159
409,2004258N16300,JEANNE,27.3,279.4,0,HU,95,2,11,290,9/26/04 06:00,2004,9,26,6,268.54,55.6372,80,80,80,80,80,60,100,-0.9987,6.7621,-5.8199,14.1845,3.2868,8.1668,1.5465,16.1151,2.2657,0.8479,4.8212,1.7403,-2.5867
410,2004258N16300,JEANNE,27.7,278.4,0,HU,75,1,9,300,9/26/04 12:00,2004,9,26,12,254.65,47.4062,120,127.5,127.5,120,150,130,110,0.5567,5.5227,-5.082,14.1558,7.7132,5.5359,1.8384,14.6139,2.1149,0.7944,5.6387,5.8748,2.329
411,2004258N16300,JEANNE,28.3,277.7,0,TS,55,0,9,330,9/26/04 18:00,2004,9,26,18,243.075,44.7896,90,145,145,200,200,90,90,-0.3044,4.8074,-4.3128,14.4763,9.9241,5.5727,2.4338,14.2296,2.165,0.8137,4.0084,7.4903,4.9766
412,2004258N16300,JEANNE,29.3,277.3,0,TS,45,0,10,335,9/27/04 00:00,2004,9,27,0,199.09,43.2297,80,142.5,142.5,180,210,80,100,0.7553,5.7044,-4.4013,13.3699,10.4703,6.1779,1.8237,15.2995,2.2625,0.8504,5.1566,8.6466,5.7333
413,2004258N16300,JEANNE,30.1,276.7,0,TS,40,0,10,325,9/27/04 06:00,2004,9,27,6,231.5,42.0602,190,137.5,137.5,190,120,120,120,2.6219,5.9373,-4.8513,13.683,11.1371,5.4839,3.557,15.4632,2.1422,0.8055,7.4732,7.5801,5.426
414,2004258N16300,JEANNE,31.1,276.1,0,TS,35,0,13,355,9/27/04 12:00,2004,9,27,12,231.5,34.5848,170,167.5,167.5,270,170,140,90,2.689,3.5118,-2.1973,13.4022,9.7394,5.1409,3.8358,13.9031,1.5256,0.5754,4.8863,5.9036,5.6832
415,2004258N16300,JEANNE,32.5,276.4,0,TD,30,-1,11,15,9/27/04 18:00,2004,9,27,18,,31.2096,280,272.5,272.5,360,280,330,120,5.3324,3.9275,-1.7585,11.8801,11.1083,4.1049,4.5714,12.2544,1.3806,0.522,7.0909,6.5369,7.4239
416,2004258N16300,JEANNE,33.2,276.8,0,TD,25,-1,9,35,9/28/04 00:00,2004,9,28,0,,28.565,290,307.5,307.5,410,290,420,110,7.126,4.0608,1.0401,10.0862,10.9363,4.623,3.0578,12.988,1.229,0.4651,6.0859,7.8785,9.8232
417,2004258N16300,JEANNE,34.1,277.6,0,TD,20,-1,14,40,9/28/04 06:00,2004,9,28,6,,27.6824,290,265,265,470,290,140,160,11.1841,2.9692,2.6163,9.3131,11.2254,4.5947,3.5975,12.4437,1.1171,0.4228,8.5678,7.6279,11.3977
418,2004258N16300,JEANNE,35.4,279,0,TD,20,-1,24,45,9/28/04 12:00,2004,9,28,12,,28.4063,320,380,380,490,320,460,250,14.4409,3.2893,4.9605,9.1976,10.4014,4.2114,3.0064,11.7359,1.6883,0.6421,9.4804,7.395,11.9964
419,2004258N16300,JEANNE,37.3,281.6,0,TD,25,-1,25,50,9/28/04 18:00,2004,9,28,18,,29.9007,370,395,395,490,370,470,250,18.6369,4.0773,4.7549,8.088,11.5237,4.3771,3.2079,12.1345,2.021,0.7706,13.882,8.3158,16.176
420,2004258N16300,JEANNE,38.3,283.6,8,EX,25,-4,16,60,9/29/04 00:00,2004,9,29,0,,30.4653,440,295,295,170,440,470,100,19.9271,2.995,3.1201,9.5604,11.4784,5.5469,0.0957,12.8829,1.7687,0.6741,16.807,11.3827,19.875
421,2004258N16300,JEANNE,38.8,285.3,20,EX,35,-4,15,85,9/29/04 06:00,2004,9,29,6,81.025,29.6182,210,237.5,237.5,210,410,200,130,21.4955,2.4565,1.5365,10.8476,9.5492,4.8465,0.5272,11.0141,1.8242,0.6942,19.959,9.022,21.8967
422,2004258N16300,JEANNE,38.5,287.5,190,EX,35,-4,19,105,9/29/04 12:00,2004,9,29,12,69.45,34.8929,300,235,235,300,290,200,150,20.8056,4.3434,4.9841,11.34,6.5135,4.3767,1.2039,9.4954,1.7906,0.6809,15.8215,5.3096,16.6739
423,2004260N11331,KARL,11.2,330.8,1327,TD,30,-1,15,270,9/16/04 06:00,2004,9,16,6,,19.0846,460,415,415,260,480,460,460,-4.9184,3.7862,-2.9554,6.7777,-0.9693,4.4888,-1.9446,3.1844,0.0418,0.0158,-1.963,0.9753,1.4752
424,2004260N11331,KARL,11.2,329.3,1483,TD,30,-1,14,270,9/16/04 12:00,2004,9,16,12,,20.4877,450,290,290,280,410,20,450,-6.6003,4.4455,-5.2727,5.7879,-1.8256,4.5913,-2.001,3.4107,-0.0174,-0.0066,-1.3276,0.1754,1.2085
425,2004260N11331,KARL,11.2,327.9,1630,TS,35,0,13,270,9/16/04 18:00,2004,9,16,18,41.67,22.2251,220,350,350,220,470,490,220,-7.4366,3.9451,-5.1054,6.9177,-0.3892,6.2457,0.1139,4.1136,0.0228,0.0086,-2.3312,-0.5031,2.3401
426,2004260N11331,KARL,11.2,326.7,1736,TS,40,0,11,280,9/17/04 00:00,2004,9,17,0,69.45,23.6349,170,275,275,170,390,370,170,-7.1158,3.9322,-3.8479,7.4758,0.0639,6.6178,1.6243,6.1346,0.1905,0.072,-3.2679,-1.5604,2.9394
427,2004260N11331,KARL,11.6,325.6,1731,TS,50,0,11,295,9/17/04 06:00,2004,9,17,6,97.23,22.9484,240,275,275,230,320,310,240,-6.0402,4.9921,-1.7681,7.5307,-1.0066,6.8612,2.4227,7.1945,0.3685,0.1394,-4.2721,-3.4293,3.1242
428,2004260N11331,KARL,12.1,324.7,1752,TS,55,0,10,315,9/17/04 12:00,2004,9,17,12,106.49,26.8206,120,155,155,120,90,120,290,-5.6315,4.6801,-2.1604,8.6867,-0.7521,6.5893,2.2058,8.8665,0.4102,0.155,-3.4711,-2.9579,2.594
429,2004260N11331,KARL,13,324,1830,TS,55,0,13,320,9/17/04 18:00,2004,9,17,18,127.325,28.5415,130,130,130,130,100,170,120,-4.5142,3.8639,-2.3734,9.638,1.1922,6.3495,3.5543,8.9708,0.5842,0.2204,-2.1408,-2.3621,0.3951
430,2004260N11331,KARL,13.9,323,1902,HU,70,1,13,305,9/18/04 00:00,2004,9,18,0,131.955,28.9338,90,137.5,137.5,90,100,270,90,-5.1679,4.5856,-3.0678,9.4565,2.075,6.8224,2.8314,8.1254,0.4868,0.1838,-2.1001,-0.7564,1.3942
431,2004260N11331,KARL,14.5,322,1852,HU,85,2,10,300,9/18/04 06:00,2004,9,18,6,148.16,31.042,90,145,145,90,170,200,120,-3.828,5.0991,-3.393,10.4456,2.5134,6.6306,2.0626,8.0545,0.6298,0.2378,-0.435,0.4508,0.6086
432,2004260N11331,KARL,15,321.2,1819,HU,90,2,10,305,9/18/04 12:00,2004,9,18,12,166.68,31.3217,90,117.5,117.5,90,120,170,90,-1.456,5.9738,-4.4029,10.0416,2.1031,6.2502,1.5013,8.2958,0.6158,0.2324,2.9469,0.6018,-2.0939
433,2004260N11331,KARL,15.6,320.3,1792,HU,95,2,11,295,9/18/04 18:00,2004,9,18,18,180.57,33.7107,60,85,85,60,100,110,70,-0.2891,7.4192,-5.4603,10.7052,1.7523,6.2366,2.6797,8.9189,0.678,0.2555,5.1712,-0.9274,-4.3064
434,2004260N11331,KARL,15.9,319.2,1733,HU,95,2,9,280,9/19/04 00:00,2004,9,19,0,180.57,40.056,80,105,105,80,160,120,60,-2.3522,5.4311,-6.0568,11.0028,1.7509,5.8022,2.5235,9.2409,0.8206,0.3094,3.7046,-0.7726,-3.6292
435,2004260N11331,KARL,16,318.4,1685,HU,100,3,8,285,9/19/04 06:00,2004,9,19,6,187.515,41.9091,110,125,125,110,190,90,110,-1.2567,5.2378,-5.0243,11.2356,2.9303,6.4666,2.5685,9.9026,1.0838,0.4088,3.7676,0.3618,-2.4544
436,2004260N11331,KARL,16.3,317.6,1658,HU,105,3,9,295,9/19/04 12:00,2004,9,19,12,194.46,44.4566,100,100,100,100,120,110,70,-2.5963,5.9406,-5.3594,11.6818,1.1658,7.0401,1.3408,10.0573,1.1389,0.4293,2.7631,-0.175,-2.6785
437,2004260N11331,KARL,16.7,316.6,1632,HU,110,3,11,285,9/19/04 18:00,2004,9,19,18,208.35,46.8349,90,82.5,82.5,90,70,90,80,-2.9875,5.8814,-6.2848,12.9582,2.2915,7.3983,1.6769,10.5802,1.4201,0.5345,3.2973,0.6146,-2.7395
438,2004260N11331,KARL,16.8,315.5,1570,HU,110,3,9,275,9/20/04 00:00,2004,9,20,0,215.295,46.6349,110,95,95,110,80,80,110,-4.2121,5.3368,-5.3467,12.8903,1.4063,7.6559,1.5456,10.3381,1.3349,0.5027,1.1346,-0.1393,-1.125
439,2004260N11331,KARL,17,314.8,1548,HU,115,4,8,295,9/20/04 06:00,2004,9,20,6,247.705,47.4593,90,77.5,77.5,90,80,60,80,-1.8766,6.8495,-4.7258,13.1454,3.8727,7.5618,2.149,11.2784,1.5688,0.59,2.8492,1.7237,-0.8881
440,2004260N11331,KARL,17.5,314,1553,HU,110,3,9,310,9/20/04 12:00,2004,9,20,12,280.115,50.722,90,85,85,90,90,90,70,-1.1219,6.6664,-5.657,13.7585,5.8838,7.8716,2.1687,12.5408,1.7585,0.6617,4.5351,3.7151,-0.0687
441,2004260N11331,KARL,18.1,313.5,1588,HU,110,3,8,320,9/20/04 18:00,2004,9,20,18,300.95,51.2432,70,72.5,72.5,70,50,100,70,-0.2386,7.4698,-5.0326,14.4652,7.327,8.3391,3.5335,13.4634,1.9054,0.7158,4.794,3.7935,1.1817
442,2004260N11331,KARL,18.7,313,1627,HU,120,4,8,335,9/21/04 00:00,2004,9,21,0,335.675,53.6675,70,75,75,60,60,110,70,0.2536,7.0474,-5.1165,14.2198,7.8575,7.4354,3.1075,13.5951,2.2525,0.8467,5.3701,4.75,1.8753
443,2004260N11331,KARL,19.6,312.7,1706,HU,125,4,11,340,9/21/04 06:00,2004,9,21,6,370.4,54.7716,40,70,70,40,70,100,70,3.1725,6.5723,-4.9681,14.023,9.3404,8.0575,3.7148,14.2855,2.144,0.805,8.1406,5.6256,3.6611
444,2004260N11331,KARL,20.8,312.2,1805,HU,120,4,15,340,9/21/04 12:00,2004,9,21,12,381.975,59.6651,80,60,60,60,80,70,30,3.3545,7.5476,-3.9599,15.131,11.5351,8.5724,2.6763,15.1528,2.2326,0.8366,7.3144,8.8588,7.2335
445,2004260N11331,KARL,22.3,311.7,1854,HU,105,3,16,345,9/21/04 18:00,2004,9,21,18,393.55,57.8123,60,72.5,72.5,60,90,90,50,0.9472,10.2594,-3.9913,14.9869,11.7901,7.6663,4.8499,15.7548,3.0146,1.1317,4.9385,6.9402,5.547
446,2004260N11331,KARL,23.7,311.2,1839,HU,100,3,14,335,9/22/04 00:00,2004,9,22,0,393.55,59.7288,60,70,70,60,80,70,70,-0.5098,9.4014,-2.9068,15.1743,8.1079,6.2065,5.1961,16.0172,3.121,1.1711,2.397,2.9118,2.17
447,2004260N11331,KARL,24.9,310.6,1822,HU,95,2,13,345,9/22/04 06:00,2004,9,22,6,393.55,57.7148,80,85,85,80,80,90,90,1.775,7.1995,-1.9787,14.0944,8.8549,4.8638,6.6248,16.7587,3.0553,1.1472,3.7537,2.2301,2.1171
448,2004260N11331,KARL,26.2,310.5,1868,HU,90,2,13,15,9/22/04 12:00,2004,9,22,12,393.55,57.1289,100,92.5,92.5,100,100,80,90,5.1321,7.7281,-0.296,14.3691,7.5345,6.0614,7.4206,17.4844,3.0715,1.1532,5.4281,0.1139,1.6898
449,2004260N11331,KARL,27.5,311.3,2003,HU,90,2,16,30,9/22/04 18:00,2004,9,22,18,405.125,62.6588,70,70,70,70,70,60,80,7.4073,6.6229,1.8467,14.3773,8.5444,5.9736,8.7482,18.1755,3.2061,1.199,5.5606,-0.2038,2.3672
450,2004260N11331,KARL,29,312.3,2016,HU,95,2,19,35,9/23/04 00:00,2004,9,23,0,439.85,61.695,70,70,70,70,70,60,80,10.9116,6.9632,2.547,14.0733,8.2088,7.4136,7.7456,18.2814,3.3871,1.2679,8.3646,0.4632,5.501
451,2004260N11331,KARL,30.7,313.7,1866,HU,110,3,23,40,9/23/04 06:00,2004,9,23,6,463,64.5803,50,62.5,62.5,50,50,80,70,13.7825,6.8848,1.4085,14.5784,10.1033,8.3791,8.68,19.1891,3.5949,1.344,12.374,1.4233,8.2955
452,2004260N11331,KARL,32.5,315.6,1737,HU,105,3,24,35,9/23/04 12:00,2004,9,23,12,474.575,65.7698,90,62.5,62.5,30,90,110,20,12.976,7.3738,1.2888,15.3682,13.07,8.6061,9.2997,18.985,2.8454,1.064,11.6872,3.7703,9.0288
453,2004260N11331,KARL,34.5,317,1594,HU,90,2,24,25,9/23/04 18:00,2004,9,23,18,486.15,58.8043,80,95,95,80,80,110,110,9.882,7.1032,3.2904,16.8386,18.6336,7.2664,9.5674,19.3275,4.0016,1.5055,6.5916,9.0662,10.9744
454,2004260N11331,KARL,36.8,318.1,1433,HU,80,1,26,15,9/24/04 00:00,2004,9,24,0,486.15,65.2306,60,82.5,82.5,100,80,60,90,6.6845,7.6,3.0527,18.6482,21.2398,9.436,7.3726,19.1298,3.5215,1.3258,3.6318,13.8672,14.2872
455,2004260N11331,KARL,39.5,318.8,1249,HU,75,1,30,10,9/24/04 06:00,2004,9,24,6,509.3,61.1307,160,120,120,160,130,80,110,3.5697,6.9092,2.8872,18.9918,25.1933,7.1997,9.1276,20.1406,3.9941,1.5167,0.6825,16.0657,15.8716
456,2004260N11331,KARL,42.6,319.5,1087,HU,70,1,31,5,9/24/04 12:00,2004,9,24,12,532.45,53.4645,90,112.5,112.5,120,90,120,120,2.339,6.9198,-0.2086,18.199,28.5072,5.6474,9.1277,20.2992,3.7531,1.4252,2.5476,19.3795,19.4729
457,2004260N11331,KARL,45.5,319.5,947,HU,65,1,28,360,9/24/04 18:00,2004,9,24,18,590.325,52.2625,130,127.5,127.5,120,130,140,120,1.5463,6.4077,-1.5215,15.7639,27.465,6.6185,9.0545,21.4416,3.4367,1.3083,3.0678,18.4105,18.327
458,2004260N11331,KARL,48.1,319.5,901,EX,55,-4,25,10,9/25/04 00:00,2004,9,25,0,590.325,50.1826,160,132.5,132.5,120,160,140,110,6.09,6.7038,1.7688,13.6165,26.5927,6.1306,9.1727,19.151,2.5259,0.9649,4.3212,17.42,17.9394
459,2004260N11331,KARL,50.4,321.1,1034,EX,55,-4,27,30,9/25/04 06:00,2004,9,25,6,590.325,48.0849,120,120,120,90,120,90,180,14.607,4.1021,6.259,13.6539,26.7277,4.2538,6.8923,18.4224,2.1432,0.8204,8.348,19.8354,21.1486
460,2004260N11331,KARL,53,323.5,882,EX,55,-4,35,35,9/25/04 12:00,2004,9,25,12,590.325,45.0579,170,147.5,147.5,140,170,140,140,16.6259,4.5346,6.4669,11.9074,26.2716,3.2969,4.0108,19.4308,2.1805,0.8394,10.159,22.2608,23.4808
461,2004260N11331,KARL,56.1,328,783,EX,55,-4,44,40,9/25/04 18:00,2004,9,25,18,590.325,40.6755,230,247.5,247.5,300,230,390,70,26.1259,4.91,11.869,10.6921,29.1824,3.6159,5.1243,16.6563,1.885,0.7306,14.2569,24.0581,26.2406
462,2004260N11331,KARL,59.5,334,506,EX,55,-4,49,50,9/26/04 00:00,2004,9,26,0,590.325,39.2346,410,260,260,390,410,220,20,34.4371,5.0495,11.9242,9.6408,18.8204,4.4196,1.1191,12.5437,1.2017,0.4684,22.5129,17.7013,27.2678
463,2004260N11331,KARL,62,343,176,EX,55,-4,48,65,9/26/04 06:00,2004,9,26,6,590.325,38.5215,150,165,165,60,390,150,60,33.1733,7.2585,11.3913,11.1245,12.1008,3.4192,0.1981,11.1238,0.9615,0.3758,21.782,11.9027,23.9184
